name,email,phone_number,date_of_birth,address,city,state,zipcode,neighborhood,preferred_contact_method,notes,client_type
Harper Garcia,harper.garcia@example.com,(273)696-7037x60324,1963-06-27,70929 Mulberry Street,New York,NY,90714-6834,Brooklyn,Mail,Tend recently already direction discuss defense later. Return whom thought of whether ball expect house. On rich artist either quickly.,Small Business
Stephanie Price,stephanie.price@example.com,531.705.2689x882,1992-02-09,915 Amsterdam Ave,New York,NY,97883-3230,Brooklyn,Mail,"In left run also. Short behavior better oil film author each human.
Ball morning card yet tend goal three hand.
Live fish can nation leg material woman still. End born bad opportunity fill.",Non-Profit
John Washington,john.washington@example.com,322-597-7488x74001,1948-08-04,987 Arthur Ave,New York,NY,17255-7862,Queens,Mail,"Model who person leave add thus. Significant someone money wish about decision. Main guess production authority heart kitchen power.
Drug loss plan indeed. Trip simply television writer seek risk.",Corporate
Chris Clark,chris.clark@example.com,001-676-755-4789x62648,2000-02-17,583 Canal Street,New York,NY,23141-1972,Brooklyn,Mail,Stop small where couple good tell with language. Trial say theory listen former open phone.,Non-Profit
Cameron Lewis,cameron.lewis@example.com,928.940.3029,1952-08-17,087 Columbus Ave,New York,NY,29616-8979,Bronx,Email,Natural apply crime should. Plan others little across tonight nice involve. Ago attack official program beat yet human.,Government
Evelyn Hayes,evelyn.hayes@example.com,(793)962-1680,1983-07-15,1315 Central Park West,New York,NY,98320-1331,Bronx,Phone,Kind yes interesting develop resource become. Part success interest table total.,VIP
Caleb Rivera,caleb.rivera@example.com,001-985-841-5364x9788,1955-07-01,01769 Hylan Blvd,New York,NY,69827-5113,Staten Island,Mail,"Campaign tree compare director door. Bed ever especially.
Themselves hotel return enjoy store teacher shake.
Usually husband drug himself. Mention share pretty analysis school offer executive.",Corporate
Aubrey Hughes,aubrey.hughes@example.com,+1-887-320-5090x3662,1964-07-31,191 Columbus Ave,New York,NY,82582-2658,Staten Island,Mail,"Man experience explain number mind mind. Reveal full politics last building enjoy. Beat best fire notice.
Certain ground training begin available reality rule. Their standard theory see.",Corporate
Joseph Foster,joseph.foster@example.com,837.304.6513,1945-11-29,4536 5th Ave,New York,NY,90576-3525,Staten Island,Email,"Mrs threat say these ago age identify.
Process option half. Property near message modern there floor green arrive. Join reality nation within everybody understand.",Non-Profit
Addison Cook,addison.cook@example.com,948.992.6562x77607,2005-02-06,645 Canal Street,New York,NY,44585-7854,Manhattan,Email,"Relationship keep hair include sea. Sister common with it traditional table.
Woman lose campaign computer beyond card.
Follow push peace recently speech mention apply fire. Herself man thousand.",Government
Eric Sanders,eric.sanders@example.com,(637)594-7425x2589,2003-11-01,14982 Canal Street,New York,NY,62687-4603,Queens,Phone,"Change will respond report value deep teacher.
Reality ground alone challenge begin. Your really seem recognize take media. A method necessary control radio number scientist pressure.",Non-Profit
Emily Watson,emily.watson@example.com,5303397070,1962-03-02,794 Mulberry Street,New York,NY,66886-6159,Staten Island,Email,"Model maintain base accept. Scientist manager one popular prove size.
Decide first staff computer me whole. Story trade let arm.",VIP
Tyler Barnes,tyler.barnes@example.com,547.586.1189x6502,2002-05-11,3404 Forest Ave,New York,NY,10561-5331,Queens,Phone,"Hope indeed whatever necessary American. Once field begin different.
Fact decision within new growth lot.
Culture contain stand capital. Now nice center else.",Individual
Grace King,grace.king@example.com,6258058339,1961-09-20,90457 Bowery,New York,NY,44912-8142,Bronx,Email,"Trade such actually about voice.
Let grow suddenly option. Glass thank center window subject.",Individual
Ashley Williams,ashley.williams@example.com,519.837.7644x27604,1996-04-10,5890 Grand Concourse,New York,NY,36630-8785,Queens,Phone,"Environmental black present organization energy effort guess. Future story make rule. Form mean five mean yeah sea.
Information yourself rate imagine loss far. National idea shake carry.",Individual
Andrew Howard,andrew.howard@example.com,(395)438-9325,1972-06-29,51995 Central Park West,New York,NY,23881-7715,Bronx,Email,Blue look evening. Training career blood finish senior agreement notice pattern. Camera series finally change trouble possible sell see. Voice act whom race soon project whom.,Corporate
Hannah Roberts,hannah.roberts@example.com,274-793-9072x102,1961-08-02,74738 Central Park West,New York,NY,13853-1476,Queens,Email,Design meet trouble draw approach. Since site image among forget view enjoy once.,VIP
Heather Griffin,heather.griffin@example.com,(743)656-3863x88722,1980-05-16,11779 Steinway Street,New York,NY,40639-1467,Brooklyn,Mail,"Media reduce crime exactly. Truth policy alone place end out.
Try final clearly model respond something government. Happen star ability person year of Democrat. Couple into cold seat week although.",Small Business
Cameron Baker,cameron.baker@example.com,001-691-997-5644x988,1946-09-09,143 Central Park West,New York,NY,12924-8398,Manhattan,Phone,Market cup among main including general. Themselves effect across push.,Corporate
Crystal Perez,crystal.perez@example.com,001-417-637-1720x20863,2004-01-02,878 Houston Street,New York,NY,57479-7930,Staten Island,Phone,"Really environmental pressure think.
Total list guess authority.
Window wait scientist hit trouble. Should success food country before ground miss.",Non-Profit
Jacob Howard,jacob.howard@example.com,888-862-7575,1960-07-03,8790 Hylan Blvd,New York,NY,24421-7989,Manhattan,Mail,Fight cost effect simple experience. Level call production result modern various.,Small Business
Layla Sanchez,layla.sanchez@example.com,454-567-8595x0115,1967-08-30,8620 Bowery,New York,NY,63497-1286,Queens,Mail,Act sing exist minute must fly discuss. Bar represent worker fear couple. Realize leader head smile meet.,Individual
Nicholas Jackson,nicholas.jackson@example.com,+1-420-701-4092,1997-02-05,9357 Amsterdam Ave,New York,NY,17818-2534,Bronx,Email,"Must against car see want window lead.
Dream rich less return. Marriage start he act force vote lot. Thank relationship environmental think ability cup body.",Corporate
Rebecca Brown,rebecca.brown@example.com,680-429-6978,1998-07-21,826 Broadway,New York,NY,21815-2474,Brooklyn,Mail,Here ability office big garden would ask. Occur economy be money audience.,Non-Profit
Samuel Nelson,samuel.nelson@example.com,395-629-9086x0890,1964-09-13,426 Broadway,New York,NY,54488-4529,Brooklyn,Email,"Nearly risk benefit how data. Box that fine test necessary matter together.
Investment accept wear.",Government
Benjamin Clark,benjamin.clark@example.com,367.780.9251,1993-09-06,3335 4th Ave,New York,NY,31676-5723,Staten Island,Mail,"Skin nature value scientist compare service. Claim international threat.
Heart international pick use exist. Person serve company personal develop of whole. Without call pressure economic.",Government
Patrick Taylor,patrick.taylor@example.com,638-418-1797,1968-12-06,977 3rd Ave,New York,NY,52546-8330,Manhattan,Mail,Fast race particularly that it far president. Have wall art ability friend rise current. Tv issue authority yet professional.,Corporate
Jane King,jane.king@example.com,001-517-760-8577x21800,1964-03-03,51514 5th Ave,New York,NY,50023-7819,Queens,Mail,"During hot type. Congress learn receive state candidate half.
Officer weight bill short. Three either realize bed per fine beautiful.",Individual
Rebecca Clark,rebecca.clark@example.com,(869)286-0598,1970-09-20,019 Victory Blvd,New York,NY,61558-1507,Brooklyn,Mail,Effort grow decide quickly doctor. Ability use owner natural. Push north field service firm turn evening.,VIP
Sarah Thomas,sarah.thomas@example.com,435-558-8401x84336,1949-05-30,2555 Houston Street,New York,NY,24659-7560,Queens,Phone,"Card five for authority action. Among physical front.
Four report drug stop. Measure artist interest. Say drug theory reason story magazine.",Corporate
Jordan Evans,jordan.evans@example.com,848-234-3141x593,1999-09-12,386 Astoria Blvd,New York,NY,82566-6141,Queens,Phone,Next budget way successful off. Serious measure well guy talk house consumer. In American according alone whose everything finish.,Corporate
Megan Price,megan.price@example.com,815.351.8917,1993-11-26,6511 Queens Blvd,New York,NY,64858-8948,Bronx,Phone,"Possible fish memory box policy. Past budget father manage Mr.
Hospital campaign beyond apply affect. Lawyer generation account. First structure exactly learn paper east.",Non-Profit
Ryan Torres,ryan.torres@example.com,001-480-914-0041x3037,1987-05-11,250 Northern Blvd,New York,NY,34038-8541,Staten Island,Email,Serious item so still. Federal another lot break example safe politics question. College most truth anything success.,Individual
Cameron Murphy,cameron.murphy@example.com,001-206-624-6390x8954,1992-05-25,0714 Broadway,New York,NY,30749-7683,Queens,Mail,"Tell address mean off red size. Education action will perhaps.
Investment race model wear society machine. Present seem partner discussion.",Corporate
Charlotte Lee,charlotte.lee@example.com,4348567613,1970-05-02,332 Jerome Ave,New York,NY,83035-4784,Manhattan,Mail,"Or small use successful might production fast. Wife herself possible religious. Heavy money your season.
Political heart executive pick face. Strong information important speech.",VIP
Amy Walker,amy.walker@example.com,211.905.2758x206,1984-01-08,564 Mulberry Street,New York,NY,46417-7397,Staten Island,Email,"Challenge church bar article marriage little happy. Series security simple. Always now hundred anything approach.
Usually bar process little American. Every his fear return author media.",Corporate
Kimberly Williams,kimberly.williams@example.com,(256)268-2778x8666,1943-12-05,6737 Canal Street,New York,NY,31396-2717,Queens,Mail,Hotel director wait it. Relate live door. Thank they share us player everyone.,Corporate
Samuel Harris,samuel.harris@example.com,+1-618-711-4760x84728,1981-04-28,386 4th Ave,New York,NY,17587-5696,Bronx,Email,Spring least career determine himself individual suggest. Just old project close fill whom. Contain left but successful value.,VIP
Sarah Carter,sarah.carter@example.com,(804)796-3589x85881,2005-07-15,3331 Queens Blvd,New York,NY,18114-5777,Staten Island,Email,Learn side field participant own street require including. Current check boy simple. Particular close another employee bring.,Small Business
Ryan Hughes,ryan.hughes@example.com,7057154554,1968-09-03,591 Grand Concourse,New York,NY,40707-4976,Bronx,Phone,"Rock rise kind for return. Another something theory fund find. Arrive foot yes true visit federal owner.
Station agency reveal information thought care still. Trade join kid. Hotel day wide.",Non-Profit
Rebecca Diaz,rebecca.diaz@example.com,943.982.2730x541,1959-01-14,006 3rd Ave,New York,NY,12693-5334,Queens,Email,Section major yourself today various large institution right. Ask once foot toward. Audience decade step worry record rise everything.,Small Business
Cameron Stewart,cameron.stewart@example.com,+1-796-339-2358,1969-10-23,37109 Steinway Street,New York,NY,41196-6246,Brooklyn,Phone,Clear each never son choose. Its pretty off. Better coach white blood mouth clearly summer. Recognize mother popular week something choose.,Small Business
Jacob Hall,jacob.hall@example.com,739-419-8094x5664,1969-08-12,191 Houston Street,New York,NY,87021-6871,Queens,Email,"Audience general plant big reflect look. Base far boy song most each. Ability look everything nor together new candidate against.
Blood value analysis.",Corporate
Jonathan Gonzalez,jonathan.gonzalez@example.com,(804)283-9257x98636,1987-08-14,99342 Madison Ave,New York,NY,56309-1820,Staten Island,Email,State weight itself. Number its treatment program rock. Rate rich son car exist boy.,Corporate
Michael Flores,michael.flores@example.com,932.307.0961x88965,1966-10-20,9557 Madison Ave,New York,NY,85794-2979,Manhattan,Phone,By plan claim plan professor religious area others. Executive work on fly. Medical public image machine just.,Corporate
Kevin Diaz,kevin.diaz@example.com,398.483.9282,1974-09-27,49823 Forest Ave,New York,NY,84420-9261,Bronx,Mail,Many involve he consider never rock tax. Box lose whom quite. Population include choice light however interesting.,Non-Profit
Samuel Collins,samuel.collins@example.com,(880)592-1160x0761,2000-07-11,576 Bowery,New York,NY,76609-6351,Queens,Phone,"Two go describe research important. Work where age.
Couple student practice force fast staff activity. Half or reflect him card when. Ask fly use quality mother place. Control north trip evidence up.",Small Business
Chloe Jackson,chloe.jackson@example.com,(476)574-0674,1954-12-17,492 Amsterdam Ave,New York,NY,68173-2650,Staten Island,Email,Describe court enough building find simple. Baby partner ball particular east quite. Instead himself step must probably.,Government
Amy Jones,amy.jones@example.com,3912255278,1966-10-10,987 3rd Ave,New York,NY,72962-9323,Brooklyn,Phone,"Summer road professional. Never wide become than ago.
Himself movie each more where consider mission. Couple concern situation. Require positive base though.",VIP
Stephanie Davis,stephanie.davis@example.com,314-756-2713,1994-10-25,297 3rd Ave,New York,NY,97977-2603,Staten Island,Mail,"Yes represent know sell official. Sell herself north throw over.
Now make participant give develop guy address. Herself sister once Mr campaign cell reach.
Scientist law matter little western young.",VIP
Thomas James,thomas.james@example.com,+1-616-398-5548x9076,1997-02-02,845 West End Ave,New York,NY,60799-9747,Manhattan,Phone,"Allow exactly size. Need two number act safe technology range financial.
Long reach phone whether. Often image actually maybe. Interview far try. Feeling member different represent green goal.",Non-Profit
Grace Moore,grace.moore@example.com,699-962-2848x64188,1960-01-07,268 Bleecker Street,New York,NY,54741-6101,Staten Island,Phone,Somebody see how tell defense. Approach southern personal chance serve challenge yes free. Base floor painting entire skin story. Second memory so approach deal protect peace.,Corporate
Patrick Rivera,patrick.rivera@example.com,654-742-1708x772,1957-04-08,53396 Park Ave,New York,NY,80272-9234,Queens,Phone,Power head yes step Mrs onto public. Collection eye which hundred account sister responsibility. Necessary on list certain campaign. Nor shoulder sign military rise arm provide.,Non-Profit
Jack Thompson,jack.thompson@example.com,+1-744-816-3587x612,1956-10-08,25039 Jerome Ave,New York,NY,37945-6451,Staten Island,Mail,"Seek bad I fish deep. Car green next there. Wall until weight trade.
Respond take next. Create though key on behavior. Build world these under positive on. Think room mother score treatment.",Government
Brian Kelly,brian.kelly@example.com,+1-829-804-9677x2607,1963-07-16,98146 Roosevelt Ave,New York,NY,68729-9306,Brooklyn,Email,Cut old decade stock exist sometimes service. Choice personal over.,Small Business
Kevin Phillips,kevin.phillips@example.com,+1-922-639-2235x071,1956-08-16,488 Victory Blvd,New York,NY,50949-1814,Brooklyn,Phone,Mission nation show eye whole represent. Project trade with trade charge win. Safe get their since.,Individual
Nicole Nelson,nicole.nelson@example.com,595-607-5061x853,1945-08-28,77504 Bowery,New York,NY,43134-5808,Staten Island,Email,"So appear trial call on. Face plan how forget.
Section hard business final treatment should. Religious major hundred option support.",Government
Amanda Ward,amanda.ward@example.com,5956458887,1948-04-27,60515 Central Park West,New York,NY,89699-1655,Brooklyn,Mail,"Thing than perform government dinner natural. Part American offer hospital term when.
Official hospital staff however.",Government
Aria Martin,aria.martin@example.com,+1-392-860-6195x18866,1959-06-17,59347 Wall Street,New York,NY,47392-1105,Staten Island,Phone,Design ground our around red. Country television while writer owner. Low then guess recently meeting. Section beat vote policy bit each.,Government
Aaron Sanchez,aaron.sanchez@example.com,553.790.5140x281,1945-12-05,85922 Bowery,New York,NY,31721-2247,Brooklyn,Phone,"Offer response assume at east. Me share assume right identify perform product. Human allow citizen home identify control.
Voice today economy along son member standard. Son imagine rock large.",Individual
Amber Collins,amber.collins@example.com,(611)880-5128x8614,1993-07-17,4145 Grand Concourse,New York,NY,48396-5525,Bronx,Mail,Cause thank herself station simply positive. Sign sort everyone series father dinner pay.,Corporate
Nora Murphy,nora.murphy@example.com,001-633-989-6551x74126,1985-05-24,7758 Arthur Ave,New York,NY,57177-5003,Staten Island,Mail,"Contain challenge by agreement line. Reach him though eat.
Stay travel accept. Response difficult lose current prove leave Democrat remain. Control floor bar.",Government
Megan Coleman,megan.coleman@example.com,(346)444-8398,1993-08-12,78314 Central Park West,New York,NY,79730-4626,Queens,Mail,"Risk better address break special. Right message phone than go. Alone table lay visit.
Economy involve us member authority. Age pick second movement data would question teacher.",VIP
Layla Brown,layla.brown@example.com,977-402-1672x49433,1966-03-24,612 Madison Ave,New York,NY,12277-8940,Manhattan,Email,"Use surface time kid. Image government accept despite.
Can bed significant wonder check attention. Kid land his star fire show.
Across might yet start. Rest focus full.",VIP
Isabella Evans,isabella.evans@example.com,001-704-352-8592,1999-10-14,11071 Steinway Street,New York,NY,83112-1695,Queens,Phone,Food local still green improve line. Several west onto dark father himself many.,Small Business
Nicole Robinson,nicole.robinson@example.com,(223)733-2458,1991-09-16,433 4th Ave,New York,NY,57086-8697,Bronx,Phone,Think open ready. Series subject clear from. About report coach strategy moment.,VIP
Matthew Thompson,matthew.thompson@example.com,(968)226-3360x995,1997-07-27,19283 Roosevelt Ave,New York,NY,62007-9489,Queens,Mail,"Girl million begin factor yeah both race. Simply young perform people small majority key. Truth small sing share region.
Speak environment kind value to. Record follow behind fund phone nation.",Small Business
Sophia Thompson,sophia.thompson@example.com,(916)313-8924x2820,1963-10-24,3906 Arthur Ave,New York,NY,62874-4669,Manhattan,Phone,"Debate debate lead according production magazine. Congress yourself add mean home.
Size all leave chair along. Both ago worker its score especially. Over condition area. Really hand customer piece.",VIP
James Rodriguez,james.rodriguez@example.com,651.854.9642x6941,1975-08-19,5183 Northern Blvd,New York,NY,90824-7657,Manhattan,Email,Sound bank machine agent manager expect. Style form nor opportunity back positive allow many. Bed find really push benefit.,VIP
James Parker,james.parker@example.com,471-481-3521,1993-09-04,41532 Park Ave,New York,NY,15702-1842,Brooklyn,Phone,"Kitchen however next laugh later total guess. Sound hair analysis impact arrive every board.
Term word street surface. Agent professor my nation alone.
Plan left particular party.",Non-Profit
Lucas Scott,lucas.scott@example.com,956.343.8096,2002-11-24,97590 2nd Ave,New York,NY,60015-6781,Staten Island,Email,Community direction agree add majority everything. Present play home serious safe miss weight. Least administration soon if find.,Government
Madison Bryant,madison.bryant@example.com,(503)530-0552x2924,2002-10-28,35089 Canal Street,New York,NY,59936-8152,Manhattan,Phone,Just remain little job truth cover dream. Father yeah road industry bank. Tv eat likely consider suffer shake store test.,Corporate
Brandon Moore,brandon.moore@example.com,001-822-951-2409,1974-08-23,6198 1st Ave,New York,NY,66140-1191,Manhattan,Mail,"Program call water important focus.
Art she performance huge easy field attorney major. Minute speech sit else save produce these role. Movie magazine guy bring chance each.",VIP
Andrew Hayes,andrew.hayes@example.com,+1-533-656-4426x900,1956-02-28,972 Queens Blvd,New York,NY,86985-7036,Staten Island,Email,Side someone day now own lawyer. Nor director garden customer allow.,Individual
Ashley Alexander,ashley.alexander@example.com,794.756.4909x2619,1978-06-20,58697 Hylan Blvd,New York,NY,66819-1472,Bronx,Mail,Must hit worker community now here. North protect my staff seek significant. Attack item sound body.,Government
Heather Turner,heather.turner@example.com,001-487-960-6894,1970-03-15,4071 Roosevelt Ave,New York,NY,77787-4478,Bronx,Phone,Religious character ready million instead painting material forget. Only face difference father baby.,VIP
Lauren Murphy,lauren.murphy@example.com,400-812-2665x42705,1943-07-30,456 Central Park West,New York,NY,32445-9067,Queens,Phone,Game task source medical course president protect writer. Military issue scientist. Play visit their really establish. Help feeling design arrive door threat.,Individual
Aria James,aria.james@example.com,(203)837-2551,1946-03-17,87850 Central Park West,New York,NY,31884-3911,Manhattan,Phone,"Country truth identify administration practice. Simple which hot receive.
Affect recognize suffer fall nice. Story pay reveal ago huge likely.",Government
Jordan Clark,jordan.clark@example.com,913-601-0922x97128,1954-10-17,44515 Grand Concourse,New York,NY,40437-1675,Queens,Phone,"Stay which and who.
Example cell itself process choice food little. Case among attack strategy. Morning however bed.
Late great production. Decision list billion mouth general.",Non-Profit
Aurora Lewis,aurora.lewis@example.com,9479525862,1969-07-01,50611 West End Ave,New York,NY,33393-7002,Manhattan,Phone,Record officer here box decade hit. Base film as get. None assume source individual. Night purpose boy movie chair allow foreign.,Individual
Timothy Richardson,timothy.richardson@example.com,229.544.7499,1968-02-01,051 Houston Street,New York,NY,89062-9718,Manhattan,Mail,"Evening may address claim standard party. Low cold value whose set nearly young chair.
Out generation coach real last field. Forward same government enter research.",VIP
Madison Murphy,madison.murphy@example.com,356.880.8321x934,1961-11-03,7932 Arthur Ave,New York,NY,83174-1928,Bronx,Email,"Fire modern interest whether. Race education room guess chance drive dinner. Upon whether rock necessary interesting article.
Offer forget and ahead. Election me former tax debate national.",Corporate
Isaac Rivera,isaac.rivera@example.com,(888)219-0636x29388,1952-03-21,982 Grand Concourse,New York,NY,83030-6724,Brooklyn,Mail,Research should manage first now. Police quality everything law. Democrat nation wish seek reason house.,Small Business
Rachel Gonzalez,rachel.gonzalez@example.com,489.523.8744x831,1993-03-01,56454 Queens Blvd,New York,NY,47647-7103,Staten Island,Phone,"Simply decade shake traditional fish campaign beat. Fear during total lay program fly fire movement.
Cause policy degree citizen. Finish approach bill key. Dream yeah issue fight sense.",Government
Dylan Jackson,dylan.jackson@example.com,+1-735-952-1464,1997-12-02,2406 Steinway Street,New York,NY,34785-5444,Staten Island,Email,"By nature generation only decision trial dark heavy.
Brother court recently. Truth thing method treatment meet.",Government
Charles Thomas,charles.thomas@example.com,001-422-740-8027,1969-06-19,3543 Jerome Ave,New York,NY,24684-1098,Staten Island,Phone,"Court article have also data stand hit. Suddenly attorney across soldier receive. Our for treat.
Fish rise year move. Coach cause product shake low there. Take more scene sure hold we fast baby.",Individual
Aaron Flores,aaron.flores@example.com,934-418-6542,2001-05-03,2209 Victory Blvd,New York,NY,64651-5641,Manhattan,Phone,"Major air they project trouble policy. Focus little especially name. Ok yeah experience huge now popular money.
Director send parent treatment yourself available. Term house still stand.",Government
Jackson Mitchell,jackson.mitchell@example.com,679.298.2003x3737,1983-07-07,453 Forest Ave,New York,NY,23691-3064,Manhattan,Email,"Within east garden life. Almost avoid leg forget medical certainly time.
Quality laugh anyone alone push. Event matter standard study collection side. Weight of stop threat remember.",VIP
Benjamin Green,benjamin.green@example.com,001-874-253-1016x06828,1948-06-27,519 1st Ave,New York,NY,31675-8070,Queens,Email,Though senior call under natural ever past. Fight safe which military lose ability. My theory issue exactly tough change consider.,Small Business
Aurora Barnes,aurora.barnes@example.com,728.404.2836x75045,1991-07-22,422 Amsterdam Ave,New York,NY,31521-2356,Queens,Email,"Article and describe traditional ok. Enjoy artist beautiful might although economy.
Discuss buy economy agreement take book. Trial keep pattern anything pretty if. Truth campaign scene college.",Individual
Zoey Bennett,zoey.bennett@example.com,001-202-510-0933x0881,1953-11-27,9526 Park Ave,New York,NY,57895-7530,Bronx,Email,"Play get conference hospital. Story character side down movement big second. Bar school three forget.
Certain west from actually situation.",Government
Olivia Clark,olivia.clark@example.com,+1-769-293-7379x65284,2003-09-15,52775 5th Ave,New York,NY,24952-4963,Manhattan,Email,"Standard camera most four significant. Word allow process generation term shoulder cup student.
Discover issue force like newspaper.",Corporate
Rebecca Jenkins,rebecca.jenkins@example.com,(848)915-9353,1994-05-05,597 Fordham Road,New York,NY,99548-7299,Brooklyn,Mail,Person church method wide party word. Change development successful range.,Individual
