name,email,phone_number,date_of_birth,address,city,state,zipcode,neighborhood,preferred_contact_method,notes,client_type
Hannah Barnes,hannah.barnes@example.com,5934962806,1953-08-17,453 Broadway,New York,NY,95158-2037,Queens,Phone,"Most need behavior employee compare use level. Wish letter imagine. Certain soldier effort.
Deep attention force former foreign determine data. Both and remain support. Line area factor majority.",VIP
Ryan Martin,ryan.martin@example.com,(291)894-6893x008,1951-06-19,13935 Mulberry Street,New York,NY,26617-6714,Queens,Mail,"Board sure trial vote able. White no sport art. Rule five left guy interest religious why.
Wish rate new page sing. Media big medical activity.",Non-Profit
Timothy Henderson,timothy.henderson@example.com,402.854.7744x875,1980-10-20,14331 Central Park West,New York,NY,39944-2242,Queens,Email,"Southern trade opportunity meet stage quickly science. Ball science dinner good relationship. Look side tell security.
Deal power gun cultural. Trip adult president sea outside financial.",Non-Profit
Ethan Collins,ethan.collins@example.com,+1-541-274-1201,1969-08-12,49737 Astoria Blvd,New York,NY,21277-1763,Staten Island,Email,Region thousand and teach sometimes recently public face. Able figure accept tree forward performance enjoy. Nation center thus determine effect.,Corporate
Michelle Brooks,michelle.brooks@example.com,+1-457-428-5207x54710,1952-09-12,84842 Madison Ave,New York,NY,68528-1633,Brooklyn,Phone,"Hotel but far wife strong letter almost have. Buy audience wind create such. Hear middle eye society thank.
Piece television safe. Hair outside break no sound require arrive.",Small Business
Aaron Washington,aaron.washington@example.com,+1-697-847-5270,1951-10-23,2345 1st Ave,New York,NY,48845-7331,Queens,Phone,"Probably street avoid him only affect indicate. Land something side.
Four series me. Age example big approach. Professor none wish value safe catch collection.",Government
Justin Russell,justin.russell@example.com,509-750-5538x4828,1980-08-13,568 3rd Ave,New York,NY,21618-4180,Bronx,Phone,"Wait tonight manage establish feeling trial. Democrat course top former often network. Practice leg second.
Ten either him above never just from. Talk relationship inside.",Non-Profit
Caleb Ross,caleb.ross@example.com,(402)385-1173x36246,1995-04-16,99986 Columbus Ave,New York,NY,46583-1767,Staten Island,Email,"Consider for of team might medical generation wide.
School serious PM rather media.",Government
Rebecca Campbell,rebecca.campbell@example.com,001-394-909-2758x4858,1949-04-10,59344 Forest Ave,New York,NY,16497-6720,Queens,Phone,Set impact side tell score authority. Raise keep effort develop create wife. Officer require rise indicate born stage fill specific.,Non-Profit
Scarlett Bryant,scarlett.bryant@example.com,+1-531-686-9465x399,1943-10-03,5054 Victory Blvd,New York,NY,28900-7120,Staten Island,Mail,"Model buy war interview wonder current. Part arrive author. Picture fine dinner these law.
Them as senior of. Imagine month two unit evidence member behavior. Learn big someone interest.",Individual
Heather Washington,heather.washington@example.com,(333)456-9485x65402,1985-04-25,71602 Houston Street,New York,NY,55012-8265,Manhattan,Mail,"Laugh control ok stock. Five risk woman growth.
Then major coach design rather present top. Notice benefit staff available. Financial within stay effort lot. Story matter sit employee.",Non-Profit
Lucas Patterson,lucas.patterson@example.com,507-691-0925x81611,2002-05-10,67014 Roosevelt Ave,New York,NY,33497-5419,Manhattan,Email,Significant wish heavy stock resource. Just garden physical rest group total trouble. Cost young about international reduce on.,Small Business
Madison Ward,madison.ward@example.com,(276)587-9588x2838,1963-01-02,2809 Fulton Street,New York,NY,97788-2404,Brooklyn,Email,"Any ever join late poor thought teach. Quickly matter want six herself treat happy wrong.
Rate time shake form guy believe hour. Hundred account television population. Son indeed modern forward.",Corporate
Jordan Patterson,jordan.patterson@example.com,415-549-8615x08323,1965-12-17,767 Houston Street,New York,NY,18765-4390,Queens,Email,"White choose moment family. Certain call parent remain.
Ahead same something meet. Church memory standard four learn all. Measure three assume building suggest daughter.",Small Business
Jordan Sanchez,jordan.sanchez@example.com,(419)270-0234x805,1984-01-13,05927 Jerome Ave,New York,NY,50595-3052,Bronx,Email,Common during administration build less however source kid. Method tonight particular this pick money.,Government
Grace Peterson,grace.peterson@example.com,338.291.5132,1945-04-10,959 2nd Ave,New York,NY,68725-7334,Queens,Email,"Wonder spend senior later democratic scene on. Its method do black that. Follow discussion view clearly question.
Challenge fact young I consider set. Most challenge laugh hard break.",VIP
Steven Morris,steven.morris@example.com,(905)372-9489,1997-04-05,2126 Wall Street,New York,NY,92886-2095,Manhattan,Phone,Brother today many wish. West subject event simple.,Non-Profit
David Wilson,david.wilson@example.com,858.367.0453,1980-01-12,24283 Fulton Street,New York,NY,70073-4456,Manhattan,Mail,Traditional condition become there candidate throughout month. Dark its people main. True contain like several. Or oil rock event on reveal.,Non-Profit
Rachel Adams,rachel.adams@example.com,701-721-4263x826,1992-11-23,91712 5th Ave,New York,NY,86274-8527,Bronx,Phone,"Them indeed certainly. Cup per people. Magazine raise cut management.
Smile camera fund page certain. Society range big couple Republican almost.
Several miss thing manage each.",Individual
Brittany Cooper,brittany.cooper@example.com,+1-417-546-2290x14911,1947-10-22,4973 Astoria Blvd,New York,NY,25717-5324,Bronx,Phone,Own still opportunity language face Democrat. Population way expert management. Former place leg agree. Attack next bit political.,Corporate
Isaac Flores,isaac.flores@example.com,+1-716-542-8877x81828,1997-07-25,207 Amsterdam Ave,New York,NY,24700-7802,Queens,Mail,"First law sister later life.
Husband western huge something garden. Then music accept society without. Purpose probably take safe.",Individual
Benjamin Turner,benjamin.turner@example.com,(294)213-1906,1966-06-21,4120 Grand Concourse,New York,NY,98584-2636,Queens,Mail,"But lead radio partner.
News pay letter dark including defense stuff. Bill issue character billion seven.",Small Business
Brian Perez,brian.perez@example.com,251.639.3010x567,2003-11-03,124 Victory Blvd,New York,NY,74820-1665,Manhattan,Email,Defense case course arm none seven top buy. Citizen agreement behavior option student. Spring very science before.,Government
Nicole Price,nicole.price@example.com,(907)837-5097x73560,1945-05-03,42684 Lexington Ave,New York,NY,87528-8581,Brooklyn,Email,Camera only single type prove. Clearly west someone certainly during situation. Skill research oil image event.,Government
Jason Reed,jason.reed@example.com,(293)888-5979x91756,1954-12-15,3452 Lexington Ave,New York,NY,11719-4449,Queens,Email,"Lead pick million rise. Hair six science threat chance go table.
Concern discover why peace modern consumer. Laugh say cause traditional.
Approach every deal several.",Individual
Zoey Brown,zoey.brown@example.com,938-821-5263x029,1966-09-23,5712 Lexington Ave,New York,NY,63591-8721,Bronx,Email,"Keep or explain kind data expert become. First cover service face.
Total bar land. About partner toward eat size.",Corporate
Sophia Jones,sophia.jones@example.com,617.988.6040,1997-12-08,825 Central Park West,New York,NY,82085-5690,Staten Island,Email,Name yeah Mr join feeling maybe condition. On report perform these. Hope window positive investment reflect name page house. Account here total instead.,Small Business
Thomas Cox,thomas.cox@example.com,+1-518-280-1249,1999-07-17,4307 Wall Street,New York,NY,14830-5791,Staten Island,Phone,Feeling man offer under letter. Writer break ok quality stand. Financial require middle identify response note.,Individual
Emma King,emma.king@example.com,900.773.4535,1994-02-23,389 Fulton Street,New York,NY,14670-7443,Bronx,Mail,Speech how who represent structure throughout. Low number factor court huge save five attorney. Simple realize sound present every.,Small Business
Connor Foster,connor.foster@example.com,548.821.5033,2003-01-31,8258 Bowery,New York,NY,79509-2987,Manhattan,Mail,"Woman air religious oil return employee customer hope. General crime week suddenly.
Throw on serve house onto truth.",Government
Mason Morgan,mason.morgan@example.com,+1-317-819-1481x02303,1999-02-03,20737 Lexington Ave,New York,NY,25850-6075,Manhattan,Email,"Personal hard range rule wide interesting purpose. Something hard he red finish.
Hard so base help trouble. Provide box act sport ahead turn partner ahead. Bring Republican fund.",Government
Jason Murphy,jason.murphy@example.com,925-360-2584x1628,1983-11-13,5074 1st Ave,New York,NY,37553-2470,Queens,Phone,"Compare attorney heart why think bit today. Pull alone future weight wrong. Authority fish view land. Upon college because many official his big.
Early area rock follow political discuss.",Small Business
Caleb Robinson,caleb.robinson@example.com,872.808.5290x2251,1979-12-20,79577 Lexington Ave,New York,NY,27266-9148,Staten Island,Mail,Near collection tree direction enter usually answer. Practice its front defense shoulder ground.,Individual
Laura Allen,laura.allen@example.com,306-419-9194,1985-01-14,035 Fordham Road,New York,NY,77337-7724,Bronx,Email,Heart laugh management free large. Seat who quickly decision kind. Structure product over ask.,Non-Profit
Aria Foster,aria.foster@example.com,724.999.7555,1972-03-19,831 5th Ave,New York,NY,95412-3613,Manhattan,Phone,Building thousand already recently responsibility. Child bank result reach behavior pressure.,VIP
Melissa Barnes,melissa.barnes@example.com,(362)279-2853x41940,1993-07-22,31331 Central Park West,New York,NY,84052-2529,Bronx,Email,Draw visit keep movie what catch move one. Effect management join plant project present window. Produce already executive reality owner may have recognize.,Small Business
Charles Hill,charles.hill@example.com,924-322-0975,1967-01-20,714 Arthur Ave,New York,NY,33284-6340,Brooklyn,Mail,"Parent institution relate black care. Service nation but federal onto check administration. Kid second stuff huge fire trip professor.
Simply their test fly stage do focus late.",Small Business
Timothy King,timothy.king@example.com,+1-847-882-9102x23292,2005-12-01,96404 Madison Ave,New York,NY,94931-9664,Staten Island,Phone,Force direction ball final onto. Well might message form term. Argue event upon also her.,Non-Profit
Anthony Hughes,anthony.hughes@example.com,+1-247-567-9927,1944-12-31,73727 3rd Ave,New York,NY,66166-6666,Brooklyn,Phone,"Receive discussion law safe. Executive science debate boy money Republican various hot. Them foreign point its.
Class financial sign play system. Land walk cover fast house field.",Individual
Lauren Lopez,lauren.lopez@example.com,6439408330,2000-03-24,323 Wall Street,New York,NY,76361-3333,Bronx,Phone,"Around beautiful minute sometimes couple later beautiful the. Per wonder speak.
Pressure tend after run enough hand.",Non-Profit
Sophia Powell,sophia.powell@example.com,(744)529-5181x8375,1956-02-09,9100 Broadway,New York,NY,67397-2583,Brooklyn,Mail,"Also sign life.
Air information soldier read. Produce evening born better although enjoy economy.",Corporate
Victoria Washington,victoria.washington@example.com,+1-443-730-6229x75641,1980-08-15,391 2nd Ave,New York,NY,91043-8862,Staten Island,Mail,"Cut yet general low edge agree likely grow.
Although say grow decision the art own. Less citizen science kind fund full card.
Certainly worker fund church. Value treatment class business.",Government
Addison Carter,addison.carter@example.com,843.220.3545,1948-09-29,841 Forest Ave,New York,NY,83276-9657,Manhattan,Phone,International they later forward say mouth go. Course health letter pass theory how magazine.,VIP
Megan Cox,megan.cox@example.com,+1-984-716-8360x722,1979-10-12,0654 West End Ave,New York,NY,42789-9642,Bronx,Email,"Operation loss decade point. Candidate two business moment third.
Change story out natural these have. Reality relate laugh season enter. Provide his buy authority even.",Non-Profit
Paisley Jones,paisley.jones@example.com,894-917-1740x197,1979-07-26,4580 4th Ave,New York,NY,95584-1264,Manhattan,Email,"Us language evening knowledge public different.
Heart lead word state admit item.
Worry late energy else. Attention subject effect probably relationship. Town crime huge bar his several.",VIP
Samantha Gonzales,samantha.gonzales@example.com,833-540-7271x458,1943-10-08,1470 1st Ave,New York,NY,64919-9194,Manhattan,Email,These game vote development responsibility. Language left population. Community car everything major better color. Man technology adult above.,Small Business
Evan Bailey,evan.bailey@example.com,887-510-8241,1971-03-06,6597 Forest Ave,New York,NY,74634-7946,Bronx,Email,"Onto now only look whether however she partner. Behind main increase also even.
Thank camera daughter there all process. Blood name rest training situation magazine at point.",Government
Rebecca Harris,rebecca.harris@example.com,233-476-9881,1977-07-30,8815 Lexington Ave,New York,NY,48059-4676,Queens,Phone,"Should woman same guy particularly. Defense him she.
Condition choice action crime world leader. Will top heavy long everyone your who. Group century bag traditional matter thousand.",Government
Amanda Smith,amanda.smith@example.com,+1-969-644-6165x358,1959-10-09,145 2nd Ave,New York,NY,79665-2968,Queens,Phone,Thought rule red fast scene main possible. Deal animal member technology decision those make fly. Above side thing sound whose. Various agent research medical list degree.,Corporate
Isabella Price,isabella.price@example.com,550.419.1901,2001-02-01,3384 Roosevelt Ave,New York,NY,94696-2443,Bronx,Phone,"Spring church pay us subject. Artist left management at actually television. Happy rather keep author time.
Amount food magazine husband we popular. Past where garden raise radio.",Government
Samuel Ross,samuel.ross@example.com,(206)686-7261x54619,1963-10-25,91997 Park Ave,New York,NY,11850-2235,Staten Island,Mail,Until part traditional be green. Born soldier about what it lot story. Beyond common work small expect.,Corporate
Eric Morris,eric.morris@example.com,4873304694,2002-11-12,5977 Mulberry Street,New York,NY,56761-3789,Staten Island,Email,Among evening participant white. Arrive any big interesting carry. Soldier class strategy better.,Corporate
Anthony Perez,anthony.perez@example.com,001-331-955-5222,1994-11-03,51518 Fulton Street,New York,NY,96690-9368,Queens,Email,Account we focus democratic base red. Security reason address under article up. Affect direction media off marriage push sometimes.,Government
Lily Carter,lily.carter@example.com,+1-848-898-1288,1981-06-24,7486 Columbus Ave,New York,NY,45548-8722,Queens,Mail,"Nice wind capital use opportunity inside attack nothing. Rather reality too exactly explain.
Catch or win value somebody reveal song hair. Soldier both impact.",VIP
James Thompson,james.thompson@example.com,(803)416-5967,1985-06-11,7044 Northern Blvd,New York,NY,72327-5101,Brooklyn,Phone,"Call campaign hand region social main. Life clearly onto positive receive shoulder.
Onto bad street series product hold green. Write bar audience beyond personal.",Non-Profit
Heather Williams,heather.williams@example.com,001-369-791-8043x35789,2005-05-08,41205 Astoria Blvd,New York,NY,41353-5715,Brooklyn,Mail,"American society discover low shoulder. State place I have drop use field big.
Marriage your travel. How once understand month option. Often region ability air term. Under network determine improve.",Individual
Robert Williams,robert.williams@example.com,826.589.8292,1943-12-14,00305 Richmond Ave,New York,NY,19111-6473,Manhattan,Email,Direction responsibility arm enough like along resource president. Return serious stock loss blood development hot. Sort recently change perform major trial role look.,VIP
Ashley Perez,ashley.perez@example.com,795-258-9623,1954-11-12,0589 Mulberry Street,New York,NY,96910-6284,Bronx,Mail,Above method write environment. Member week her realize house. Case popular outside executive seat today.,VIP
Ashley Lewis,ashley.lewis@example.com,591.649.6896x20603,1960-08-26,53080 Jerome Ave,New York,NY,78433-6865,Bronx,Mail,"Particularly feel meeting million international lead. Employee difference store tax leader safe indeed.
Various news court job view happen list. Get I point enjoy recognize.",Government
Anthony Anderson,anthony.anderson@example.com,001-984-837-7697,1984-05-28,941 Columbus Ave,New York,NY,94031-1347,Brooklyn,Phone,Toward report either in enjoy same. Performance season low family pressure dog.,Corporate
Caleb Green,caleb.green@example.com,589.272.2290x43652,1966-05-20,433 Northern Blvd,New York,NY,56655-6720,Staten Island,Email,"Into pressure wear a total. Board tree hold account material. High say put meeting could foot once.
Song score rock experience. Six floor concern statement but.",VIP
Jane Perry,jane.perry@example.com,668.232.4948x7960,1983-04-29,4867 Mulberry Street,New York,NY,15417-7561,Bronx,Email,"During church clear let book time rich. Talk space great upon. Win young board.
List bag fact trip woman compare although. Machine change state small.",Government
Charles Johnson,charles.johnson@example.com,001-292-464-1827,1994-09-02,8752 Wall Street,New York,NY,70145-1539,Brooklyn,Email,"Second certain tree defense edge actually themselves hospital. Call do arm drop. Live shoulder within ago perform rock.
Can industry fall how. Issue final building turn. Together media wife drive.",Non-Profit
Joshua Nelson,joshua.nelson@example.com,506.340.6095,1956-02-22,6681 Bowery,New York,NY,15811-8425,Manhattan,Email,"Teach then against stop position state film. Hold whose health make building position sport.
Appear attention sea imagine. Mission college believe share hear man by. Line radio people apply big walk.",Non-Profit
Isabella Torres,isabella.torres@example.com,001-445-749-7922x843,1994-12-18,736 Houston Street,New York,NY,59137-4247,Bronx,Email,"Office responsibility dinner director develop of trade. Ask ask dog worry. Never feeling blood fly fund.
Measure truth together mean.",Individual
Jacob Jenkins,jacob.jenkins@example.com,265-210-5206x628,1952-12-19,3289 Hylan Blvd,New York,NY,86969-2010,Queens,Phone,"Different north daughter maintain then.
Design small allow. Follow the unit travel else entire stand. Former common condition show student significant American.",Small Business
David Gray,david.gray@example.com,321.324.2991,2006-06-27,73265 Grand Concourse,New York,NY,71434-8458,Queens,Phone,Order member her message today military once. Finally cost remember new score agreement argue its. Standard claim couple right son question. Another over building body make.,VIP
Mason White,mason.white@example.com,001-245-733-1626x19529,1992-12-19,3567 Arthur Ave,New York,NY,36437-5365,Manhattan,Email,"Drug commercial Mr past foot drop hear meeting. Of agency standard ready job building to.
System sure statement war ok. Agreement although thing what keep. Good choose interview.",Small Business
Joshua Garcia,joshua.garcia@example.com,9908409619,1971-07-06,27610 Fordham Road,New York,NY,56688-2292,Staten Island,Email,"The poor area pull.
Window teacher mean. Continue senior sing strong personal available girl. I hit wife activity. Moment walk line explain decide.",Non-Profit
Benjamin Williams,benjamin.williams@example.com,718-492-6937x23140,1997-06-06,917 Victory Blvd,New York,NY,13277-3769,Queens,Phone,"Eat once left win.
Report production military program. Economic new arm unit show use structure seek.
Hope mean speech edge forget. Produce heart employee only.",Non-Profit
Emily Hernandez,emily.hernandez@example.com,+1-414-765-1046x85214,1943-09-02,2207 Jerome Ave,New York,NY,44660-1091,Queens,Email,"Bill with while. Herself out adult sign figure magazine do budget.
Situation father memory response picture section allow. Court third campaign night level focus over. Five plant bank.",Government
Elijah Howard,elijah.howard@example.com,359-756-9568,1974-06-03,146 Fordham Road,New York,NY,61550-8149,Bronx,Email,"Picture box control begin. Billion which idea himself. The marriage second.
Item age employee reflect quality. Might six be push next result evidence.",Corporate
Kimberly Jones,kimberly.jones@example.com,5834707117,1985-04-16,642 Jerome Ave,New York,NY,16416-9094,Staten Island,Phone,"Theory where service medical full last structure. Process cause camera how how. Imagine prevent respond wide.
Believe charge reveal science interesting. Organization appear yard style.",Small Business
Anthony Turner,anthony.turner@example.com,683.893.8764x57229,2004-02-09,0144 Grand Concourse,New York,NY,75139-8923,Brooklyn,Email,"Plant effect power college those country ok. Body senior change response effort.
Scientist ok first political certain environment. Worker best region court modern.",Non-Profit
Steven Baker,steven.baker@example.com,+1-926-434-6340x16649,1972-02-29,13934 Houston Street,New York,NY,22848-3842,Staten Island,Mail,Letter benefit health natural treat away. Congress radio simply right participant better himself. Skill have page nothing attorney leader building ground.,Corporate
Isabella Green,isabella.green@example.com,001-851-707-2882x58404,1956-02-17,238 Richmond Ave,New York,NY,83368-1659,Queens,Email,"Product weight foot draw bad. Director whole image service wait watch brother. Road appear degree probably they material sort.
Scientist say hit job. Want fire return us some choose form.",Small Business
Justin Foster,justin.foster@example.com,579.917.7216,1989-09-29,1356 Fordham Road,New York,NY,77095-7217,Staten Island,Phone,"Up how father management clear. Interesting none less believe world last. Toward decade back teach mind.
Color say reach tonight. Method address time some remain create.",Non-Profit
Rachel Sanchez,rachel.sanchez@example.com,888-640-5422x15997,1964-06-21,7359 4th Ave,New York,NY,48326-7960,Brooklyn,Mail,"Color decade boy risk. Another as likely whole.
Window coach rich adult drop training. Make heart local positive country should ever his.",Small Business
Justin Baker,justin.baker@example.com,890-434-0890,1961-04-08,9395 Wall Street,New York,NY,14538-2844,Brooklyn,Phone,"Back our impact everything early yard. Serve science behavior man read discover find power. Pay eight fight out.
Understand throw team energy our concern from. Pick class business bill.",Corporate
Nicole Cook,nicole.cook@example.com,(294)239-6516x7932,1999-08-11,21953 5th Ave,New York,NY,11364-9987,Queens,Mail,"Reduce bill win instead. Blood like those carry consider watch.
Fill sing scientist share music be. Bring note mouth several need color. Nice because up black.",Non-Profit
Lillian Hall,lillian.hall@example.com,692.967.4018,1972-09-13,765 4th Ave,New York,NY,91213-6243,Queens,Mail,"Course without officer remember.
Themselves step sort sure in. Nearly face office often positive nation.",Small Business
Ellie Butler,ellie.butler@example.com,(836)320-4152x53719,1992-08-10,1850 Fordham Road,New York,NY,37049-3550,Queens,Mail,Adult quality particularly picture chance team rise against. Find never assume. Then better support series example.,Small Business
Addison Roberts,addison.roberts@example.com,+1-966-702-1621x976,1984-04-11,88867 Bleecker Street,New York,NY,86627-1311,Bronx,Phone,"Word already we. Walk structure compare wear rise painting class.
Agreement there often lead. Focus condition test stand particularly. Treatment table knowledge decision especially business.",Non-Profit
Aria Nelson,aria.nelson@example.com,(851)857-6722,1957-02-22,210 Fulton Street,New York,NY,14861-7196,Manhattan,Mail,"Surface off wonder arm deep example thus. Trip plan purpose shake total Mrs next. Month my board so rest. Lose idea evening daughter guess.
Time song bar hear. Color he for memory write bank.",Corporate
Patrick Thompson,patrick.thompson@example.com,718.434.3494x37609,1963-06-16,233 Queens Blvd,New York,NY,32460-4281,Brooklyn,Email,"Fight cold black what part probably process pattern. Push who feeling night. Front top own rock outside loss.
Goal sort anything almost. Attorney question likely than thing rich.",Corporate
Isaac Nelson,isaac.nelson@example.com,001-414-930-8252x3226,1977-03-07,884 Canal Street,New York,NY,10075-3900,Brooklyn,Mail,City interesting green debate message enough. Avoid down water view deep official.,VIP
John Bailey,john.bailey@example.com,001-316-863-7576,2001-10-08,85149 Roosevelt Ave,New York,NY,25761-6132,Manhattan,Email,"Lose eat successful low natural answer radio. Measure certainly picture particularly painting unit data.
Security some enjoy defense push space middle different. Despite single once continue.",Corporate
Addison Hill,addison.hill@example.com,328.779.9898x58762,1961-04-12,1974 Columbus Ave,New York,NY,43858-8909,Manhattan,Phone,"Marriage process turn wind. Film executive national especially cold break time.
Morning marriage word any expert. Water hope material activity.",VIP
Elijah Johnson,elijah.johnson@example.com,495.993.2711,1972-10-24,122 Roosevelt Ave,New York,NY,42209-6952,Manhattan,Phone,See woman personal indeed half. Technology since enjoy newspaper front candidate. Bit sign quickly national wrong seat anything.,Small Business
Jordan James,jordan.james@example.com,+1-957-941-1646,1974-11-18,1917 Fordham Road,New York,NY,66377-9928,Manhattan,Email,Account control first forget follow school operation. Price decision member second health position catch.,Individual
