name,email,phone_number,date_of_birth,address,city,state,zipcode,neighborhood,preferred_contact_method,notes,client_type
Aurora Henderson,aurora.henderson@example.com,001-539-986-6283x06390,1970-02-19,827 Park Ave,New York,NY,50151-2701,Manhattan,Email,"Buy floor friend task for occur house. Fight worry door trade speak pay. Believe rather close state.
Candidate work inside color individual pay exist. Way unit cup discover behind.",Corporate
Emily Barnes,emily.barnes@example.com,727-528-7680x674,1974-09-17,6480 1st Ave,New York,NY,16592-9511,Manhattan,Email,"Around environment site. Service will significant listen agree staff. Hear take record western image social could.
Mean benefit yeah city. Age himself garden land shoulder beat make media.",Small Business
Kimberly Clark,kimberly.clark@example.com,001-746-657-5401,1961-09-11,8080 Broadway,New York,NY,88027-7570,Brooklyn,Mail,"Son sometimes result event fine. Player player job participant late gun them.
Some respond keep hair. Create role us clearly next maintain everybody. Right two often out money our air.",Government
Paisley Hayes,paisley.hayes@example.com,001-687-406-7602x1970,1950-12-07,7238 Northern Blvd,New York,NY,15781-5649,Brooklyn,Mail,Common sometimes life ever itself accept us several. Expert fund court card imagine music per air.,Individual
Gabriel Kelly,gabriel.kelly@example.com,251-981-6682x7340,2001-12-16,3619 Richmond Ave,New York,NY,30166-6554,Brooklyn,Email,"This discover Mr. Spring of drop head. Model carry as resource land girl rich.
Sure enter pull pick foreign amount apply. Each of moment machine property stuff more not.",Government
Aubrey Baker,aubrey.baker@example.com,440-959-0834x55411,1986-01-29,67499 Broadway,New York,NY,55111-7690,Staten Island,Email,"Course lead new order fight. Agent audience election live show century week.
Attorney soon herself hope hold attorney professional. College painting in magazine court operation almost.",Government
John Coleman,john.coleman@example.com,001-454-754-9161x08300,1991-02-22,3414 Jerome Ave,New York,NY,80634-2018,Brooklyn,Phone,Despite expert positive experience teacher. Agency activity hold this recognize yard must. House partner choice worry official. Attorney in prevent tree interview people nor.,VIP
Megan Gray,megan.gray@example.com,001-658-909-2013x539,1999-08-18,4819 Astoria Blvd,New York,NY,34182-3490,Staten Island,Phone,"Dog sure challenge rise Republican loss during business.
Me per enter. Forget sense near choice compare off me. Statement hot mind sort owner. All develop strategy industry.",VIP
Stephanie Clark,stephanie.clark@example.com,(650)505-4882,1985-01-01,449 Arthur Ave,New York,NY,24935-7345,Staten Island,Mail,"End agree even point ground defense. Third future also. Me because maybe see piece fear.
Wrong remain how writer adult onto.
Boy send prevent question.",VIP
Stephanie Wilson,stephanie.wilson@example.com,001-316-777-2831,1948-05-06,938 West End Ave,New York,NY,93493-4108,Queens,Mail,Nature if range person day my professional. Close or newspaper edge home value share.,Government
Scarlett Young,scarlett.young@example.com,340-359-5365x16056,1960-02-23,56637 3rd Ave,New York,NY,95672-1731,Staten Island,Mail,"Theory either human treat usually. Occur hand third player per ago.
Three us analysis site first. Memory rate anything me.
Accept answer save read. So culture simple.",Government
Robert King,robert.king@example.com,001-273-648-4812x555,1955-08-13,0005 Hylan Blvd,New York,NY,73755-9529,Staten Island,Email,View to truth peace from who. Rich article imagine. Behind avoid several someone box note.,Non-Profit
Ashley Russell,ashley.russell@example.com,296-688-8122x5964,1954-12-30,093 Steinway Street,New York,NY,17819-2103,Queens,Phone,Reveal west bank see. Perhaps ok class area seven. Kitchen turn summer fear.,Individual
Daniel Cook,daniel.cook@example.com,769.808.4019,1944-10-19,82320 Steinway Street,New York,NY,63199-3688,Brooklyn,Mail,"Figure threat reveal weight go section voice fish. Scene do environment choose audience another. To old picture reflect.
None inside alone something. Whatever rise exist thus appear.",VIP
Brandon Scott,brandon.scott@example.com,325-265-1813,1965-05-30,3341 Wall Street,New York,NY,61989-6532,Staten Island,Mail,Shake something authority seat bed. Interview usually sound question development another.,Non-Profit
Michael Cooper,michael.cooper@example.com,217.435.4228,1980-06-06,68512 Mulberry Street,New York,NY,37609-2852,Brooklyn,Email,"Red must meeting. Station own hour radio yourself land sense hundred.
Carry nature newspaper contain create fund. Marriage relationship into management will listen recent.",Corporate
Mason Sanchez,mason.sanchez@example.com,(422)383-7243x236,2002-12-27,521 Lexington Ave,New York,NY,12212-2385,Manhattan,Phone,"Life rise author learn. Room lay data writer better. Describe power you when.
Just likely north including senior likely. Process investment imagine join talk worry. Message identify partner worker.",Government
Robert Cook,robert.cook@example.com,447-438-0562x0224,1979-09-11,121 Northern Blvd,New York,NY,67540-4711,Brooklyn,Phone,"Under mind owner when at. Far Congress recent finally throw listen almost. Well response certain.
Wonder dark admit enter history. Mother money idea scientist idea successful.",Individual
Michelle Hernandez,michelle.hernandez@example.com,+1-454-562-8961x02766,1947-04-14,57801 Wall Street,New York,NY,35742-2911,Manhattan,Phone,Professional whose baby local he prevent human. Better decision owner military staff ok station might.,Non-Profit
Caleb Gray,caleb.gray@example.com,(613)342-9029,2005-02-02,36319 Arthur Ave,New York,NY,53695-9154,Staten Island,Mail,Democratic sing into policy share common discussion. Force camera Congress imagine list exist key reduce.,Individual
Samantha Foster,samantha.foster@example.com,+1-418-934-8736x673,1961-08-10,369 Mulberry Street,New York,NY,46605-2900,Brooklyn,Phone,"Remain something notice none official. Sign ago nearly age animal. Behind conference fish loss.
Firm be create. Unit cover seek which center my space. Seem chance number exactly.",Non-Profit
Jonathan Brooks,jonathan.brooks@example.com,910.284.3978x504,1965-11-24,2759 Forest Ave,New York,NY,74646-1307,Queens,Mail,"Within sell company film.
Or art actually analysis white low. Police weight house. Money food ground fish possible middle. Throw past southern how.",Non-Profit
Lauren Young,lauren.young@example.com,(430)519-8795,1969-08-21,53855 2nd Ave,New York,NY,71299-1096,Staten Island,Email,Source free clear according. Knowledge new appear dog since. College authority decade form game check move. Staff bar his stand.,Corporate
Hannah Green,hannah.green@example.com,001-625-507-7995x7863,2003-02-25,127 Steinway Street,New York,NY,86863-4925,Manhattan,Phone,"Trial town read measure here wide boy. Us watch want. Theory such hear court.
Plant end specific option of boy. Without degree responsibility sell well.",Government
Megan Thomas,megan.thomas@example.com,660-534-6038,1989-09-01,206 Madison Ave,New York,NY,61418-5022,Brooklyn,Phone,Pass itself chance activity everyone artist say throw. Daughter clear dark despite opportunity. Change some one. To begin wide music.,Corporate
Lauren Stewart,lauren.stewart@example.com,837-628-2687x91277,1989-06-07,161 Broadway,New York,NY,90252-4222,Staten Island,Phone,"Important baby all listen. Huge pass spring well.
Voice air lead it. You ready increase save treatment.
Likely several specific for. Cultural example where fine them.",Government
Cameron Hayes,cameron.hayes@example.com,436-933-5608x20220,1980-09-28,377 West End Ave,New York,NY,97460-6100,Bronx,Mail,"Town may only church make game. House too challenge model maybe skill policy.
Face ago major hair. Get rather art every partner human.",Corporate
Cameron Brown,cameron.brown@example.com,3799907249,1962-05-04,827 Roosevelt Ave,New York,NY,70993-8056,Brooklyn,Mail,"Organization father group near machine if. Image type class for western dinner.
Course animal our. Young fine thank analysis. Itself method man land tax mention late face.",Government
Aaron Miller,aaron.miller@example.com,713.364.2879x33091,1947-07-25,1576 Jerome Ave,New York,NY,84407-6242,Brooklyn,Email,"Tonight car response whatever site. Reduce if arm let into result surface fly. Agency thank film outside improve employee growth her.
Hundred two sea teacher start across impact police.",Small Business
Daniel Morgan,daniel.morgan@example.com,377.553.8066,1972-07-22,93100 Astoria Blvd,New York,NY,45415-3962,Bronx,Phone,Maintain development most exactly himself already. Ground off region use. Magazine event door remain evening find parent.,Individual
Justin Roberts,justin.roberts@example.com,001-554-925-8770,1995-06-06,711 3rd Ave,New York,NY,16664-9621,Manhattan,Mail,"Piece station world whose. Show coach pull.
Discussion score may bit recognize father.
Detail control talk seek final. Six major race else join water.",VIP
Aubrey Gonzalez,aubrey.gonzalez@example.com,483.836.3358x1409,1964-03-26,4201 Amsterdam Ave,New York,NY,96820-4852,Staten Island,Phone,Operation image whom discussion happen represent. Would age young which. Society conference strong scene system course family.,VIP
Jacob Coleman,jacob.coleman@example.com,+1-826-440-2483,1965-01-20,36224 Bleecker Street,New York,NY,65740-2133,Queens,Email,"Serve realize recognize and need candidate test. Necessary practice quickly.
Administration respond woman even upon its stuff feel. Early while including. Up water country four much.",Individual
Caleb Cox,caleb.cox@example.com,+1-502-978-3811x18945,2002-07-20,85201 Lexington Ave,New York,NY,80596-7902,Brooklyn,Mail,"Front including no fall. Almost arm compare bad.
Rise plan door will.
Might practice hour billion perhaps central society teach. Impact know onto city another finish. Option condition foot very.",Small Business
Ryan Gonzales,ryan.gonzales@example.com,(372)329-1033,1971-04-01,842 Victory Blvd,New York,NY,26480-2776,Manhattan,Email,Many onto product decision human half bed. Little organization attorney effort report.,Individual
Samuel Edwards,samuel.edwards@example.com,443-310-6016x4003,1972-09-03,17598 Steinway Street,New York,NY,66089-9375,Bronx,Email,"Suffer best offer baby. Meet forget good beat six. Keep throughout nothing production able we police.
Positive or later. Upon civil test power note collection million. Total weight science heart.",Non-Profit
Thomas Wood,thomas.wood@example.com,818.773.2096,1988-08-05,223 Northern Blvd,New York,NY,17626-3455,Brooklyn,Phone,"Seek treat various describe. Public whatever despite challenge language. Worry specific north lead cost.
Enter hotel easy. Toward human through hard force find.",Non-Profit
Avery Bell,avery.bell@example.com,+1-366-317-6764x8443,1983-02-04,60034 Fulton Street,New York,NY,62934-3102,Brooklyn,Phone,"Quite try act certain bad allow majority. College week drive nearly decide almost week. Last cut simply third else.
True must economy unit pick. Water its yet like staff.",Corporate
Melissa Russell,melissa.russell@example.com,5413062201,1991-03-12,53728 3rd Ave,New York,NY,46380-3251,Brooklyn,Phone,"Mr agent activity author. Nearly southern because else.
Billion wide long form shake business. Middle modern too look environmental adult. Chance always plant will condition scene because size.",Non-Profit
Andrew Scott,andrew.scott@example.com,001-290-516-1167x606,1999-09-16,39056 Steinway Street,New York,NY,69488-8694,Bronx,Mail,Last must change culture can few main. System company voice property involve future. School try good amount contain writer.,Individual
Jack Long,jack.long@example.com,428.394.2163x05904,1959-12-29,0165 Bleecker Street,New York,NY,39345-8701,Queens,Email,"Analysis weight idea treat. Political current I take.
Skin peace hotel major happy behind. Financial pass test simply. Social floor because official program actually security begin.",Small Business
Michael Sanchez,michael.sanchez@example.com,339.524.1234,1999-06-06,359 Arthur Ave,New York,NY,65041-3312,Bronx,Mail,Court amount trouble customer stage degree. Choice how page foreign practice design. Everybody however rate yes. Institution him everybody.,Corporate
Aubrey Johnson,aubrey.johnson@example.com,243.739.5543,1960-05-21,749 Fulton Street,New York,NY,39313-1742,Queens,Phone,Policy do administration into. Surface late even rich name interesting. Marriage think color. Green charge beat majority son coach meeting.,VIP
Stephanie Hughes,stephanie.hughes@example.com,6826017243,1947-11-29,2916 Fordham Road,New York,NY,46798-3442,Staten Island,Email,"Member body news. Ball can seem question modern believe way.
Moment throw interview chance entire prepare decade. Month discuss quite across food.",Government
Megan Bailey,megan.bailey@example.com,(629)609-8642x1056,1996-05-08,924 Canal Street,New York,NY,85369-8756,Manhattan,Email,"Explain various federal surface. Describe Republican easy no box describe away. Amount plant someone why on.
Government community type happen.",Non-Profit
Amanda Cox,amanda.cox@example.com,586-438-8742,1985-06-28,532 Mulberry Street,New York,NY,57706-3450,Manhattan,Email,"Begin during explain risk magazine fight plan. With collection book concern school.
Interview usually character yourself. Eye probably address base development.",Corporate
Jonathan Hughes,jonathan.hughes@example.com,001-805-244-7967x35523,1969-07-30,4868 2nd Ave,New York,NY,77883-7389,Staten Island,Phone,"Fall key site once page since. Bit ball spring message memory food.
Certainly significant long remember describe. Financial interview director huge plan enter special. Point herself argue.",VIP
Eric Parker,eric.parker@example.com,(799)897-0027x9935,1980-12-13,36625 Wall Street,New York,NY,60351-3666,Brooklyn,Mail,"Course food water what. Time hard strong thousand friend instead.
Cost while last. Likely morning who discuss discuss yes.",Government
Rachel Washington,rachel.washington@example.com,(545)481-5847,1959-09-30,5263 Mulberry Street,New York,NY,10347-2589,Manhattan,Phone,Conference throughout instead generation they little world better. Affect put compare. Off market even.,Non-Profit
Jason Patterson,jason.patterson@example.com,7293552060,1957-12-07,3912 1st Ave,New York,NY,60774-9029,Staten Island,Mail,"Fill executive hard federal space seem front speak. Enjoy issue participant him.
Former central huge should nearly. Professional want focus three man himself.",Non-Profit
Jack Price,jack.price@example.com,(614)806-0889,1956-02-06,20719 Canal Street,New York,NY,86702-2599,Bronx,Email,"Manager family beat issue yeah. Check along happy treat.
Go red red notice. Make region stage effect send. Assume available floor off.
Seem series finish significant. Ask eat air magazine oil.",Corporate
Mia Jenkins,mia.jenkins@example.com,876-683-3848,1983-01-25,03708 Arthur Ave,New York,NY,90882-8996,Queens,Phone,"Think beyond arrive I majority my. Near this two reflect office degree.
Congress loss economic goal available nearly. For citizen possible challenge. Others read and suffer decade.",Non-Profit
Crystal Harris,crystal.harris@example.com,721-335-4382x17119,2006-03-30,881 Houston Street,New York,NY,64080-9436,Staten Island,Mail,"Spring mother accept above station ten single sort. Improve letter identify up return.
Reflect care character make. Walk themselves series clearly official participant for best. Stand position site.",Government
Kimberly Collins,kimberly.collins@example.com,553-589-7822x32964,1952-02-23,05427 Park Ave,New York,NY,83709-2892,Brooklyn,Email,Lawyer open future probably someone effort what by. Against last gas rule worry establish. Impact east summer even public.,Non-Profit
Hannah Walker,hannah.walker@example.com,+1-298-649-4012x42966,1971-03-27,475 Canal Street,New York,NY,19811-2805,Brooklyn,Phone,"Join executive culture capital data security product.
Keep drug happen could happen. Next body sea camera.
Them doctor daughter knowledge environmental. Car house decide perform.",Corporate
Eric Garcia,eric.garcia@example.com,290.762.5660,1968-07-29,183 Forest Ave,New York,NY,34479-2562,Bronx,Email,"Push speech full these bit son action night.
Others agency against. Range summer property prove be main. Interesting knowledge difference religious best.
Wait low rule last film.",Corporate
Alexander Flores,alexander.flores@example.com,686-909-3138,1975-10-29,55956 Arthur Ave,New York,NY,21655-4748,Bronx,Mail,It difficult staff air. He energy speak image imagine administration. Prepare democratic get do art.,VIP
Jackson Campbell,jackson.campbell@example.com,960-689-6455x525,1999-08-01,9648 Forest Ave,New York,NY,43465-5084,Manhattan,Mail,"Name single who let per others to. Goal present must. Drive some owner of. Later myself realize.
Continue ago indeed unit room song. Fall finish little street.",Individual
Elijah Phillips,elijah.phillips@example.com,001-402-624-2944x63984,2002-10-11,634 Jerome Ave,New York,NY,95286-8855,Staten Island,Phone,"Run mean act college want. Big benefit security note people certain western. Development radio everything black ever.
Responsibility time half rest alone. Position would environment different.",Government
Alexander Wilson,alexander.wilson@example.com,001-348-954-4749x11677,1996-02-22,99033 Arthur Ave,New York,NY,25144-5079,Bronx,Phone,"Why thought social. Whom though red candidate most.
Side work quite blood participant everybody. Shoulder message book address mean something discussion.",Individual
Eric Alexander,eric.alexander@example.com,+1-673-944-3268x2893,1962-06-22,0119 Steinway Street,New York,NY,42335-7987,Bronx,Email,"Environment under fill similar since. More wife policy.
Clear out response piece reflect full. Least food energy pay act.
Agency control Mr together. Ability late example candidate see know risk.",Non-Profit
Isaac Gray,isaac.gray@example.com,487.827.1397,1962-01-11,233 2nd Ave,New York,NY,23416-9336,Brooklyn,Email,Book when summer maybe focus painting. Support executive through light better former be. Than practice single president appear better.,Small Business
Adam Campbell,adam.campbell@example.com,(217)990-7427,2001-04-24,3762 2nd Ave,New York,NY,68637-2693,Staten Island,Mail,"Technology else win significant talk. Cell weight anything staff. Moment century factor the consumer.
Southern might glass short. Source vote interesting. Foreign bank professional.",Non-Profit
Nicole Ross,nicole.ross@example.com,+1-892-658-7566x680,1945-06-23,9234 Broadway,New York,NY,98735-7256,Bronx,Phone,"Material trip simply capital than model still. Bag government different stuff wide feeling else.
Who by physical western including. Poor reflect design national scientist professor.",Corporate
Laura Price,laura.price@example.com,+1-620-840-9075,1956-11-22,376 Fordham Road,New York,NY,70921-8212,Queens,Phone,Especially foot newspaper clear resource sort. Protect news wide we glass defense. Well building lose study own.,VIP
Stephanie Hernandez,stephanie.hernandez@example.com,+1-837-553-0075x61423,1958-06-24,09775 Broadway,New York,NY,10507-8546,Bronx,Email,"Win soon last southern. Deep can group deep opportunity.
She must down compare.
Culture table compare much campaign provide pull. Cause foot whole town political not. Second consider week himself.",Non-Profit
Logan Barnes,logan.barnes@example.com,(906)505-8709x558,1974-06-20,44559 5th Ave,New York,NY,89760-3252,Staten Island,Email,Car figure find center throughout brother stand away. Would see office training culture even. Structure security traditional scientist too.,Individual
Elijah Murphy,elijah.murphy@example.com,794.737.9892x3125,1947-10-29,583 Mulberry Street,New York,NY,85211-9748,Bronx,Mail,"Reality audience expect.
Health only show raise trip. Follow street degree company. Live president explain forward.
Center heavy town black point. Local close result.",Small Business
Jessica Taylor,jessica.taylor@example.com,754-791-8606x740,1952-01-22,99065 Queens Blvd,New York,NY,67122-5659,Staten Island,Phone,"Decide final dinner wind avoid ability rock lead. Film car answer bank. Amount me possible arrive crime.
Radio quite over phone. Help road huge everybody real key.",Corporate
Ethan Green,ethan.green@example.com,001-204-481-2139x3805,2002-11-04,80757 Broadway,New York,NY,51766-8602,Brooklyn,Mail,Down bring discuss investment. Phone western seem region. Dog include certain young kind send.,Government
Megan Jenkins,megan.jenkins@example.com,(363)624-7526,1966-06-04,9966 3rd Ave,New York,NY,44659-8076,Manhattan,Phone,Drive miss bit single fast. Author program course teach something. Contain member bad price car.,Government
Samuel Gonzales,samuel.gonzales@example.com,+1-722-520-0033x7980,1963-07-28,9321 Grand Concourse,New York,NY,13061-8769,Staten Island,Mail,Economy arrive different person physical. Provide character already way bank send. Enjoy subject face knowledge whatever page. Finish myself interesting difference manager system company.,Small Business
Brittany Jones,brittany.jones@example.com,413-668-1328,1952-10-01,87349 Wall Street,New York,NY,96546-7696,Manhattan,Phone,Future performance election spend. White drop another western.,Small Business
Andrew Jenkins,andrew.jenkins@example.com,3839926052,1999-04-29,9476 Bleecker Street,New York,NY,15363-5650,Queens,Phone,"Fine leave close politics fire condition. Number sometimes test.
Stop here three paper concern. Need enter entire across.",Government
Addison Williams,addison.williams@example.com,(371)695-6695,1976-09-28,13624 Mulberry Street,New York,NY,79619-8503,Queens,Email,"Even guess drug near. Baby term foreign lot. Despite hotel entire trip.
East agree ten community where about. Method physical up fight. Pick raise option then.",Individual
Paisley Allen,paisley.allen@example.com,(541)291-6750,1962-11-09,20595 Steinway Street,New York,NY,34703-9237,Queens,Phone,Will strategy quality sea. Wind project full foreign foreign article couple. Reveal test participant peace own.,Corporate
Dylan Mitchell,dylan.mitchell@example.com,+1-629-422-9544x71192,1958-12-21,726 Richmond Ave,New York,NY,71783-2485,Bronx,Phone,"Soon radio sound know decade. Play attack example particular American. Expect tough though.
Stock prepare small serve model. Clearly simply rock per vote.",Small Business
Laura Johnson,laura.johnson@example.com,682.381.4662x109,1953-10-02,94729 Amsterdam Ave,New York,NY,25431-6609,Staten Island,Phone,"Deal responsibility create. Room fish city tend. Artist something score water.
Career culture probably report cold human wish. Everything story call.",Non-Profit
Emily Bell,emily.bell@example.com,(810)643-2458,1959-08-27,740 Broadway,New York,NY,88388-9131,Staten Island,Mail,"Democratic someone bad order. Various pass produce over quite development reason side.
Least child together wall someone politics growth. Last hospital door act everybody guy bad.",Small Business
Charles Cooper,charles.cooper@example.com,(304)667-6280,1962-06-05,85718 Hylan Blvd,New York,NY,62043-8612,Brooklyn,Mail,"Evidence lawyer enter none always. Head form option. Task leader field.
Huge base close professional give. Want foreign my simply I doctor. Big boy set prepare about word prevent never.",Corporate
Justin Murphy,justin.murphy@example.com,(554)921-1853,2003-05-05,601 Wall Street,New York,NY,90268-8627,Bronx,Phone,"Strong week enough question. Month why star low throw.
Check always red until threat real.
Live truth save turn artist yet ok. Theory design travel card car to.",Small Business
Olivia White,olivia.white@example.com,001-376-812-9282x0636,1983-04-12,90551 Jerome Ave,New York,NY,61483-2398,Queens,Email,"Fill knowledge should wonder thus. Story whose consumer strategy.
Some might bad perhaps live. Try campaign power ready close increase heavy. Series cost should.
Answer rather opportunity.",VIP
Patrick Murphy,patrick.murphy@example.com,001-990-813-5175x07386,1953-02-11,79777 Columbus Ave,New York,NY,53538-8840,Bronx,Mail,Something strategy young appear quality field let hand. Movie race exactly right. Between not analysis.,Government
Cameron Hall,cameron.hall@example.com,001-301-807-7324x040,1999-02-04,804 Park Ave,New York,NY,58193-3531,Queens,Phone,Center sell hospital really record fall. Tonight something a look those.,VIP
Mia Lee,mia.lee@example.com,576.898.1583,1949-07-13,76378 Steinway Street,New York,NY,58985-3108,Staten Island,Email,"Ahead instead task. None whole full series authority until exactly.
Open debate work staff. Significant pass thank sure brother. Sign rich seem analysis avoid throughout center.",Corporate
Gabriel Barnes,gabriel.barnes@example.com,001-486-992-7413x1344,1994-07-11,68386 Queens Blvd,New York,NY,42135-5183,Manhattan,Phone,"Exist economy last business produce. Tough doctor language bar maintain development.
Center system since need doctor American. Office know impact.",VIP
Heather Martin,heather.martin@example.com,840.610.2320,1994-02-19,3868 Arthur Ave,New York,NY,15805-1340,Manhattan,Mail,"Offer case eight win cut need gas. Ball father rate. Or yet performance right commercial church type eight.
Politics plan soon thousand far. Physical country none.",Individual
Emma Cooper,emma.cooper@example.com,(513)947-3575,1981-08-03,492 Astoria Blvd,New York,NY,28232-2570,Staten Island,Email,"Yard hard adult bring. Market level item personal fall state bill tell. Pass compare month fly sometimes mother.
Standard operation improve way bill market. Suddenly visit set treatment week.",Non-Profit
Amber Rivera,amber.rivera@example.com,671.343.6366x682,1950-05-23,3196 Lexington Ave,New York,NY,65716-5978,Bronx,Email,"Scene cover up federal item argue. Office second phone free phone. Financial energy stage.
Some interest he moment despite section employee.",VIP
