name,email,phone_number,date_of_birth,address,city,state,zipcode,neighborhood,preferred_contact_method,notes,client_type
Thomas Adams,thomas.adams@example.com,(890)565-1570,1994-09-21,218 Amsterdam Ave,New York,NY,70205-1791,Manhattan,Email,Past customer investment clear. Machine east young reality style appear church west. Election least pressure set necessary statement.,Government
Laura Long,laura.long@example.com,328.870.2307,1956-07-21,56826 Lexington Ave,New York,NY,47123-8214,Queens,Phone,"Police war certainly half one course above follow. College resource father agree then. Nothing arm step yes realize city.
Image health politics less media your become.",Non-Profit
Lauren Hernandez,lauren.hernandez@example.com,329.474.4573x52828,2005-05-25,3133 2nd Ave,New York,NY,11660-2590,Brooklyn,Phone,News impact entire or. Hard must goal choice suffer option thank along. Situation always in wide.,Government
Paisley King,paisley.king@example.com,992.508.7417,1995-08-17,6949 Columbus Ave,New York,NY,82761-2629,Queens,Email,All read main Mrs wide laugh. Population good body skin hand politics practice. Image green themselves modern vote picture.,Individual
Amanda Bell,amanda.bell@example.com,+1-488-868-1705x53261,1959-04-24,9120 Northern Blvd,New York,NY,46625-6943,Bronx,Email,"Else full TV. Pattern something institution win protect choose reduce.
Doctor simple visit she recently former someone need. She budget whether real catch.",VIP
Steven Scott,steven.scott@example.com,(205)203-1347,1983-06-06,145 Forest Ave,New York,NY,53523-1504,Brooklyn,Phone,"Trip these field recently. Mind stand respond party environmental meet. Peace although short least.
Debate school Mr. Best remain myself wall determine heart interview rather.",Small Business
Patrick Kelly,patrick.kelly@example.com,001-732-811-9580x2785,1956-07-29,938 Forest Ave,New York,NY,23502-6196,Queens,Email,"Consumer soldier discussion believe citizen talk. Couple teacher cold exist reach. Without seem or fast beat.
Discussion tonight team late able rich. Song since over factor son.",Individual
Olivia Alexander,olivia.alexander@example.com,921-469-6160,2004-10-03,5023 Astoria Blvd,New York,NY,99733-2164,Manhattan,Mail,"Prepare around feeling newspaper produce green with wish. Memory final kid chance indeed enjoy.
Key training manage thank worker cause money. Serve now conference try since.",Non-Profit
Jordan Harris,jordan.harris@example.com,+1-516-543-7371x3223,1986-02-27,603 Bleecker Street,New York,NY,90853-5006,Manhattan,Email,"Four no road face than be run perhaps.
Part action science add wonder. Girl participant save authority. Network culture majority skill bring son medical. Decade staff style road cost practice.",Government
Ethan Scott,ethan.scott@example.com,(450)467-8235,1981-09-06,23010 Grand Concourse,New York,NY,20338-9310,Brooklyn,Phone,"Fear receive far enjoy answer among political offer. Technology clear gas occur. Drug by baby character.
Play mention wrong authority professional. Would investment over man agreement.",Small Business
Jason Diaz,jason.diaz@example.com,(919)468-6749,1965-03-04,0695 Fordham Road,New York,NY,78163-4170,Bronx,Mail,"Entire building last would. Represent power tonight cold unit. Form clear town rest produce total way cause.
Nor collection safe these weight vote age. Explain reflect current activity.",Small Business
Nicole Howard,nicole.howard@example.com,671.241.7960x59557,1976-11-11,8300 Astoria Blvd,New York,NY,71694-1183,Queens,Email,Buy its dog democratic explain several central. Opportunity successful finally candidate memory. Service thus drop resource. Already add clear identify candidate.,Government
James Williams,james.williams@example.com,(830)786-7083,1989-04-05,106 West End Ave,New York,NY,27591-8499,Manhattan,Phone,"Language role behind size. Bank me walk poor service fight stop. The outside special pretty quickly Congress.
City wall fear ground game economic. Race decide total understand alone learn camera.",Corporate
Chloe Cox,chloe.cox@example.com,971-405-1975,1974-07-22,90820 Grand Concourse,New York,NY,46610-7085,Manhattan,Email,Machine send turn share guess theory group wide. Question fill teach himself any service. Up choose guess receive interesting.,Small Business
Andrew Phillips,andrew.phillips@example.com,(992)777-7264,1980-05-15,8776 West End Ave,New York,NY,28667-1909,Queens,Mail,"Establish reality exist debate goal organization try. Indicate sport think all.
Far environmental almost trouble pass. Effect suddenly everyone miss movement own room.",Corporate
Patrick Murphy,patrick.murphy@example.com,701.392.2364x124,1976-11-07,4243 3rd Ave,New York,NY,31729-7790,Queens,Mail,"Term sometimes about lawyer serve edge. Hold it time rate evening politics.
State last throughout back. Miss international positive take yeah. More pretty drop film rate year.",Government
Ethan Taylor,ethan.taylor@example.com,211-436-8917,1963-09-03,583 Northern Blvd,New York,NY,74608-9299,Bronx,Email,Not audience whom than discuss ability method. Push subject century dog home draw wear decide. Control black data.,Corporate
