name,email,phone_number,date_of_birth,address,city,state,zipcode,neighborhood,preferred_contact_method,notes,client_type
Melissa Patterson,melissa.patterson@example.com,001-721-404-4583x410,1972-07-09,7197 Madison Ave,New York,NY,34169-4721,Manhattan,Phone,Day hand offer bed sense shake eat each. Sign matter full factor. Culture around another how walk.,Small Business
Andrew Wilson,andrew.wilson@example.com,543.668.8438,1979-01-08,27033 Wall Street,New York,NY,37864-8564,Brooklyn,Email,"Church gas if pressure. Area whether race argue.
Include add nothing American civil. Factor serious want. Truth world toward.",Small Business
Brittany Johnson,brittany.johnson@example.com,606-623-6906x7056,1945-02-23,970 Madison Ave,New York,NY,21742-2719,Staten Island,Phone,"Card although beyond experience. Specific paper law meet article offer will both. Natural bag major majority whose increase.
Use three girl than fall religious enter range.",Individual
Emily Perez,emily.perez@example.com,(969)489-3055x853,1947-10-16,525 Jerome Ave,New York,NY,68939-5832,Manhattan,Phone,"Resource together glass old seat. Character return kid instead.
No hope half able study officer. Lawyer television though be four nice staff.
Financial country final value measure serve crime people.",Corporate
John Hill,john.hill@example.com,480.477.1357x305,1982-07-13,961 1st Ave,New York,NY,21394-2338,Manhattan,Email,"Window remain those animal point green. Particularly view human live. Evidence few pick Mr society none.
Bad network government team high program. Skill play drive carry huge.",Corporate
Elijah Miller,elijah.miller@example.com,890.970.4180x80159,1943-12-07,314 Park Ave,New York,NY,43204-7687,Manhattan,Phone,"Light stop statement. Buy know more court really security decide.
Plan high why between certainly crime Republican.",VIP
Brandon Diaz,brandon.diaz@example.com,+1-829-501-2578x465,1993-08-03,1084 Steinway Street,New York,NY,47705-6327,Brooklyn,Mail,"Question really least product draw everybody. Situation letter according write property.
Spring else along record money feeling particularly. Put person garden important financial newspaper father.",Individual
Robert Harris,robert.harris@example.com,879-504-0031,1985-04-12,578 3rd Ave,New York,NY,63747-2211,Staten Island,Mail,Fine effect there within life speech real. Stop sit term special cold other study.,Individual
Avery Rogers,avery.rogers@example.com,+1-960-411-8342,1993-04-30,47945 Fordham Road,New York,NY,12131-8581,Queens,Phone,"Poor sign data structure. Major red particular.
Bed eight public technology for trial read. Who start positive generation.
Region Mrs partner position house response.",VIP
Rebecca Smith,rebecca.smith@example.com,678.304.5808,1984-05-19,0309 Canal Street,New York,NY,31412-8792,Queens,Mail,"Entire answer mention yet alone how soon. Same window your door sea.
Arm former last much. Up five often some now democratic on. Even quite win.",Corporate
Isabella Diaz,isabella.diaz@example.com,001-980-227-6850x4266,1945-04-02,01954 Queens Blvd,New York,NY,78706-2504,Bronx,Email,"Least seven bed. Hope increase energy respond huge.
Rule think there attorney its loss major. Daughter social nation. Behind own believe firm painting receive.
Gun scientist this.",Non-Profit
Lillian Roberts,lillian.roberts@example.com,555-646-7207,1991-03-09,59805 Houston Street,New York,NY,87956-4552,Manhattan,Phone,"Modern out future it or despite himself. Save too face whose want experience recent.
Evening reflect ask opportunity exist most build. Old place activity serve.",Corporate
Joshua Torres,joshua.torres@example.com,622.978.7112x4540,1964-02-15,6990 3rd Ave,New York,NY,37470-8957,Staten Island,Email,"Hour pass develop heart ok. Alone hard ground get.
Order enough away stop threat do seven. Process about remember operation hundred lawyer. Citizen seat century different.",Small Business
Melissa Allen,melissa.allen@example.com,(560)974-2826x82884,1983-06-30,36183 4th Ave,New York,NY,76042-8957,Brooklyn,Mail,"Stay along skin. Money small treat list worry. Sort carry make democratic opportunity between stand drive.
Cold successful plan teach. Risk tell per return water. Thing detail always customer.",Individual
Madison Walker,madison.walker@example.com,323.292.6273,1983-08-29,630 Hylan Blvd,New York,NY,47125-5299,Queens,Mail,"Success page rather agreement film. Health big read great. Suggest everything east exactly create catch exactly.
Traditional standard trial include for lead reflect. Drug face create third.",Non-Profit
Paisley Allen,paisley.allen@example.com,001-523-842-1148x0620,1965-06-03,3660 1st Ave,New York,NY,18998-8011,Manhattan,Phone,"Discuss short many pattern ability. Identify establish miss water. Peace sell watch quality response both respond.
Goal I scene part book. Education memory number business hit.",Individual
Megan Reed,megan.reed@example.com,7918863033,1984-12-23,457 Richmond Ave,New York,NY,79422-4790,Staten Island,Email,"Than include machine particularly. That water finally clear bad particular story. Though together some crime.
Tax last candidate poor effort tough line. Culture who center song radio.",Individual
Abigail Ross,abigail.ross@example.com,671-625-9500,1945-07-29,4391 Houston Street,New York,NY,94466-3282,Bronx,Mail,"Case condition dinner style voice. Health life each put office produce key.
Say person and least institution identify. Democrat difficult prevent level impact practice would. Rate difficult police.",VIP
Amanda Reed,amanda.reed@example.com,+1-411-472-8609x49320,1950-09-09,99464 Grand Concourse,New York,NY,25227-2035,Brooklyn,Phone,Bring nothing red hear that improve pay us. Particular produce actually herself evidence history. Go myself wife eye put. History present billion.,VIP
Dylan King,dylan.king@example.com,(712)733-2006x729,1951-02-26,30797 Amsterdam Ave,New York,NY,57576-5303,Manhattan,Mail,"Foot cause boy seek Mr training those. Seem audience result wear option.
Sense get throughout any. Anyone agreement sister oil dog career. Third least hope than on lead offer.",Government
Lauren Watson,lauren.watson@example.com,846.937.3970,1996-01-13,5553 Fordham Road,New York,NY,68197-2628,Queens,Mail,"Just total add quite air hospital. Nor heavy prevent near stop.
Shoulder beautiful there term man. Prepare physical wear home measure. See yeah full stop place.",Corporate
Kevin White,kevin.white@example.com,447.252.7799x10194,2000-04-28,0384 Park Ave,New York,NY,40579-6068,Brooklyn,Email,"West century city according.
Why mother role look activity effort health. Per account Democrat here put indicate beyond firm.
Ready anyone size high want life fine. Day personal young.",Corporate
Crystal Ramirez,crystal.ramirez@example.com,001-424-570-2925x31883,1944-10-30,92328 Richmond Ave,New York,NY,40607-9019,Manhattan,Mail,While human news special guess day situation. Be exist program writer page many. Military manager I arrive hear see degree.,VIP
Isabella Perry,isabella.perry@example.com,(461)247-4326,2004-07-24,4415 Arthur Ave,New York,NY,75264-6303,Staten Island,Phone,Level class sort star capital not. Situation start environment feeling employee war. Again few responsibility yard large.,Government
Layla Wright,layla.wright@example.com,427-296-4112,1992-04-25,21499 1st Ave,New York,NY,41706-8950,Brooklyn,Mail,"National help necessary point. Way reason cost situation explain.
Send contain available serious. Despite father herself increase big reason. Trial lead huge consumer building and.",Government
Melissa Martin,melissa.martin@example.com,+1-563-534-2434,1946-06-30,40109 Park Ave,New York,NY,40038-9710,Staten Island,Phone,"Exist city century cut money me. Heavy there near difficult feel live.
Turn reflect she trade memory which history senior. Fly across general civil apply film.",Government
Nicole Murphy,nicole.murphy@example.com,680-623-8418x4737,1985-09-03,790 Northern Blvd,New York,NY,78652-2894,Queens,Phone,Ground institution feel left. Term show six determine box against. Bar hand rest minute easy home within.,VIP
Kimberly Martinez,kimberly.martinez@example.com,304-481-9851,1979-08-08,79980 2nd Ave,New York,NY,78200-2077,Manhattan,Phone,Figure Mrs foot economic. Positive section part cup six sea left against. We region rather concern.,Individual
Steven Brooks,steven.brooks@example.com,377-701-7742x9226,1991-08-23,0685 Lexington Ave,New York,NY,15507-2774,Queens,Phone,"Song various memory drug central picture return.
Player bed government suffer green our. Word thus raise off then you.
Late know career present plant. Agent science board statement.",VIP
Aurora Moore,aurora.moore@example.com,+1-762-386-0971,1981-10-12,281 Fulton Street,New York,NY,10006-4944,Queens,Email,Position character he run account born. Anyone rock could job first action I. Which job difference you success crime. Size common successful activity.,Individual
Hannah Long,hannah.long@example.com,(965)953-0339x72930,1975-01-31,22152 Astoria Blvd,New York,NY,85642-8920,Bronx,Mail,"Firm cost social trial. Write answer from technology open long stock.
Party other peace government history. Born matter movement.",Corporate
Charlotte Ramirez,charlotte.ramirez@example.com,+1-869-247-3825,1955-02-09,226 Bleecker Street,New York,NY,15716-6482,Queens,Email,"Land model hold present just we movie nor. Community trial since commercial ground source man.
Gas really experience. But allow by paper ready. Head according play national should.",Individual
Grace Butler,grace.butler@example.com,9189629210,1985-08-03,01999 Wall Street,New York,NY,23411-9650,Manhattan,Phone,Space result home pay class. Of item clearly political. Building opportunity issue education statement site president hear.,Government
Nicole Parker,nicole.parker@example.com,350-903-4145x701,1962-08-10,983 Bleecker Street,New York,NY,82320-9341,Bronx,Phone,"Short sit these thought. Last stay maybe. Church cold boy hair.
Letter film finally style lot. Service southern machine discussion. Price without wrong talk its Congress.",Small Business
James Coleman,james.coleman@example.com,001-595-973-3195x15083,1975-06-20,950 Hylan Blvd,New York,NY,20798-4861,Brooklyn,Phone,Wrong rich administration sister star. Month story on actually at adult fish.,Small Business
Scarlett Ramirez,scarlett.ramirez@example.com,+1-438-646-6451x73583,1995-03-16,3837 Fulton Street,New York,NY,50026-6467,Brooklyn,Phone,"Voice feeling second. House weight stand mouth ok use.
Me form young. Future someone success. Glass pull everything provide.",Government
Patrick Stewart,patrick.stewart@example.com,356.580.4366,1957-08-29,77224 Madison Ave,New York,NY,59973-9653,Bronx,Mail,"Upon former may century. Truth during you vote news.
Material these anyone party drug. Less star firm seem these. Particularly give fact particularly avoid. Experience wrong walk get process way.",Non-Profit
Addison Hayes,addison.hayes@example.com,+1-799-970-0084,1965-12-28,536 Victory Blvd,New York,NY,47109-6855,Brooklyn,Mail,"Take market defense direction rate trade. American country Mr.
Adult peace PM.",Government
Anthony Stewart,anthony.stewart@example.com,(205)498-9023x0329,1999-02-26,843 Steinway Street,New York,NY,74981-2467,Queens,Email,Late floor person more. Move cover region also mouth indicate current. Court forward fish tell under mind. Address office way record for degree morning between.,VIP
Caleb Brooks,caleb.brooks@example.com,5794356228,1960-02-04,2151 1st Ave,New York,NY,28812-6436,Queens,Email,"Hair its box memory item wear bad upon. Nor camera cause fact by debate authority. Ball throw road anyone.
Information report majority might anyone quality large. Through rich without relate away.",Small Business
Thomas Watson,thomas.watson@example.com,+1-838-730-4311x43022,1951-05-31,316 Hylan Blvd,New York,NY,24636-5990,Bronx,Mail,"Available drug check ask also yard remember.
Address future think alone. Board soldier street style product.",Small Business
Gabriel Morris,gabriel.morris@example.com,+1-337-534-0878x358,1986-06-04,3733 Park Ave,New York,NY,83865-7695,Bronx,Mail,Everything drive suddenly spend tend hour when. Hit per minute reach affect. Language sign this country I only.,Government
Aaron Cooper,aaron.cooper@example.com,4524605587,1974-07-11,8192 Fordham Road,New York,NY,50461-9618,Queens,Email,"Maybe fight range yet spend lose. Former professional fund. Stage most lead high itself hair do wife.
Lay when central Congress.",Small Business
Madison Diaz,madison.diaz@example.com,353-496-9842x3642,1997-01-07,246 Jerome Ave,New York,NY,77231-3690,Brooklyn,Mail,Name according mention take admit line president lead. Everyone hotel assume across affect mother exist. Improve into condition indicate fear second score.,Small Business
Laura Hernandez,laura.hernandez@example.com,001-498-425-8845,1948-10-16,1153 Amsterdam Ave,New York,NY,90986-4627,Brooklyn,Phone,Agent son east officer century quality. Painting military seek boy medical onto. Treatment today attention relationship animal he low.,Small Business
Amy Martinez,amy.martinez@example.com,215.864.4245x57286,1996-07-07,65086 Madison Ave,New York,NY,27714-5933,Brooklyn,Phone,"Individual these specific find impact suggest. Couple article could dog. Market animal police so.
Tough inside economic. Window reflect full through quality character. Lot church democratic plan.",Corporate
Emily Gonzales,emily.gonzales@example.com,001-207-659-7329x722,2000-03-20,463 Steinway Street,New York,NY,35896-2792,Manhattan,Phone,Several debate team bank. Fine successful offer simply energy win structure. Describe actually white quickly ball develop past.,Small Business
Brian Ramirez,brian.ramirez@example.com,553-495-6567,1994-06-05,140 Northern Blvd,New York,NY,55929-8327,Bronx,Mail,"Sit help above beat. Once measure blue trouble whether.
Make central free source card buy attorney. Increase music purpose modern.",VIP
Nora Lewis,nora.lewis@example.com,(425)843-3909x416,2001-09-17,042 Houston Street,New York,NY,48345-2790,Staten Island,Email,Join impact federal room mind. Happy very some film. Reach she its other instead.,Non-Profit
Connor Young,connor.young@example.com,644.688.2727x5429,1989-05-07,701 Fordham Road,New York,NY,17242-5338,Brooklyn,Mail,"Soldier member four bar. Represent history not lawyer science charge.
Realize store pressure want site morning. Teach into well cut.",Corporate
Aubrey Scott,aubrey.scott@example.com,001-237-748-1300x160,2005-01-30,735 Columbus Ave,New York,NY,75025-4204,Queens,Phone,"Future truth box write common wish human. Deep that amount up buy. Name scientist cost note discussion.
Itself option identify politics various hold be. Establish expect young conference.",Individual
Steven Hayes,steven.hayes@example.com,261-499-1491x0307,1983-12-23,6961 Amsterdam Ave,New York,NY,26501-4300,Brooklyn,Mail,Evidence color respond exist nature as. Oil claim generation however leader. Same before magazine administration strong feel trial.,Small Business
Justin Murphy,justin.murphy@example.com,645-971-6366,1957-02-09,778 3rd Ave,New York,NY,77570-3614,Staten Island,Mail,"Fine Congress understand about opportunity. Quite sister receive chair.
Chance herself bad. Yeah return tree message pay view boy just.",Individual
Kimberly Harris,kimberly.harris@example.com,217-204-4790,1961-11-23,053 Jerome Ave,New York,NY,20498-5257,Manhattan,Mail,"Use late minute among dark member. Their fish necessary. Argue myself debate rate service.
Fight simply suggest agreement. Travel young whether soldier.",VIP
James Smith,james.smith@example.com,674-320-8182,1996-08-26,2601 Columbus Ave,New York,NY,44227-9103,Queens,Phone,"Education loss law live himself animal best. Actually front system prove somebody.
Important resource ready number. Main professor rule employee. Care like safe several.",Non-Profit
Ashley Roberts,ashley.roberts@example.com,001-239-842-4559x701,1959-08-05,751 Madison Ave,New York,NY,81784-3085,Brooklyn,Mail,"Adult agency put. Condition war administration even.
People drive threat mean middle whom like. Morning avoid hour story poor expert she.",Government
Aria Miller,aria.miller@example.com,753-757-9998x74821,1975-01-17,8830 3rd Ave,New York,NY,89535-7268,Manhattan,Mail,"Hold chair standard operation agency. Give chair production factor option beautiful rate.
Able there eye ahead candidate act realize. Performance pass hair girl dream subject fly.",Corporate
Nicole Patterson,nicole.patterson@example.com,001-608-256-1120x59276,1980-04-21,6561 Northern Blvd,New York,NY,55973-9633,Staten Island,Email,"After conference believe approach response air. Low bag new.
Side level open anything eight special read. Four present event enjoy strategy kid.",Government
Jessica Green,jessica.green@example.com,319.957.7655,1972-08-03,4861 Roosevelt Ave,New York,NY,49195-4192,Staten Island,Mail,"Institution risk control itself write. Seem theory positive else push.
Answer production citizen. Appear along property manage he change. Treatment boy maintain training.",Individual
Nicole Young,nicole.young@example.com,+1-892-261-6124x96196,1944-04-08,5222 Jerome Ave,New York,NY,37443-5694,Brooklyn,Email,Cultural reason admit note laugh yourself staff together. Front once what either.,Individual
Grace Watson,grace.watson@example.com,001-820-827-4379x0715,1997-04-16,6030 Bowery,New York,NY,80250-3289,Manhattan,Mail,Wind seek ability simply oil. Sound improve art simply hit minute word. President quality thank three responsibility relationship nation west.,Corporate
Scarlett Coleman,scarlett.coleman@example.com,377.417.3904x062,1944-08-20,47520 Houston Street,New York,NY,35392-2253,Manhattan,Email,"Could middle effect magazine candidate. Guess book share four if fast.
Kitchen music yes edge last. Mission night operation experience kind.",Corporate
Olivia Diaz,olivia.diaz@example.com,591-732-6891,1969-04-20,96117 Grand Concourse,New York,NY,12391-6625,Bronx,Phone,"Case truth guy particularly forward. Work interest during.
Leave yet manager fire each arm discussion.
Listen report development support. Pm if third where perform where music item.",Non-Profit
Cameron Lee,cameron.lee@example.com,284.782.4258,1994-09-18,280 Northern Blvd,New York,NY,92091-8721,Bronx,Phone,"Herself job various future message your call. Particular break onto week staff.
Civil find rest to Congress keep religious.",Individual
Isaac Brooks,isaac.brooks@example.com,2183490116,1949-05-19,02301 Astoria Blvd,New York,NY,92238-9435,Brooklyn,Phone,"Good everything tell teach tell term several. Treatment fire offer ground again. Enough southern rate paper southern sit local.
Series industry it strategy. So age reality loss minute.",Government
Charlotte Diaz,charlotte.diaz@example.com,779-229-0731x59333,1994-11-25,603 Astoria Blvd,New York,NY,53135-6300,Queens,Email,"Service however huge. Some beat growth staff.
Leader behavior avoid available left investment.
Alone anything north.
Box sort than myself much poor. Better easy feeling anyone century despite.",Non-Profit
Melissa James,melissa.james@example.com,515-299-8826,1956-12-03,1089 Amsterdam Ave,New York,NY,11759-5081,Manhattan,Mail,"End sport establish only. During play either same civil feeling glass. Likely notice growth throw each all around.
Politics push hotel expect. Move economy face mind range.",Non-Profit
Logan Moore,logan.moore@example.com,+1-273-495-9247x85365,1957-03-06,0876 Fordham Road,New York,NY,71923-3364,Manhattan,Email,"Strategy result them view. Third join method somebody.
Else what much prove. Hope that mention last live.",Individual
Zoey Gonzales,zoey.gonzales@example.com,305-573-5064x863,1961-10-16,3463 Bowery,New York,NY,21107-6896,Bronx,Phone,Name ahead your first commercial situation goal inside. Politics class fact tough. Some eat investment before change maybe nature. Physical nation improve sell health word.,Non-Profit
Harper Washington,harper.washington@example.com,+1-770-370-2057x199,1957-11-05,6832 Victory Blvd,New York,NY,19374-3214,Staten Island,Email,"Debate off forget traditional could. Ask make pick thing later possible matter car.
Tv receive talk magazine garden meeting for. See let door step sure month. Research sort management nor.",Individual
Layla Bryant,layla.bryant@example.com,679.652.9370x007,1984-05-04,218 3rd Ave,New York,NY,41036-9090,Staten Island,Mail,"With while religious trouble. Make show end fine give fact. Finish control mention state.
Talk perform different pay movie food. Black spend by place call specific piece.",Individual
Paisley Green,paisley.green@example.com,(682)378-7405x4674,1966-05-21,9663 Bowery,New York,NY,21855-7110,Queens,Email,Performance general mother how the walk possible. That marriage modern most watch image. Wall government arm suffer reason however. Pressure same central reality successful listen someone story.,Non-Profit
Timothy Bailey,timothy.bailey@example.com,001-471-649-8341,1984-06-07,5356 Columbus Ave,New York,NY,22473-5906,Manhattan,Mail,"Them although line environment see since myself three. Might lay treatment debate figure small. Group protect even nor military yard.
Catch decide coach note. Dark reality director than.",Non-Profit
Ashley Butler,ashley.butler@example.com,494-492-2486,1955-05-31,42456 Victory Blvd,New York,NY,65387-5750,Manhattan,Email,Large us might difficult though. Ten bill test development cost price. Sign skin fly compare describe hospital. Future teach treat budget soon watch family summer.,VIP
Zoey Patterson,zoey.patterson@example.com,253-640-5557x78012,1958-04-05,7840 Richmond Ave,New York,NY,48553-4006,Brooklyn,Email,"Total mind heart particularly simple thus area. Watch spring feeling. Movie around future without.
Stock card sea bank forward debate writer. Play compare represent customer.",Corporate
Aubrey Price,aubrey.price@example.com,(639)974-7307x429,1982-07-22,8087 3rd Ave,New York,NY,53290-2122,Queens,Email,"Budget ask increase. Effect two black public since conference. Director myself onto voice same mother spring.
Wide every foot month always care. Sure new late type down debate season.",Corporate
Penelope Hayes,penelope.hayes@example.com,(730)444-9051,1971-10-18,494 Jerome Ave,New York,NY,47237-8164,Queens,Mail,Southern southern become decide perform she everything. Smile catch force recently would mind region.,Individual
Chris Turner,chris.turner@example.com,(957)358-1203x7164,1961-11-26,0510 1st Ave,New York,NY,67956-6535,Manhattan,Mail,"Bed how it card event. Hundred family section factor serve. Dream his its beautiful decision purpose.
Audience newspaper result protect. Woman three that check.",VIP
Zachary Johnson,zachary.johnson@example.com,001-231-478-2953x1822,1971-08-22,62121 3rd Ave,New York,NY,56014-7117,Queens,Phone,"Suffer ever treatment benefit. Large happy base should. Say star imagine either something.
Anything future without. Citizen sell yes technology safe lose wide political.",VIP
Joseph Rogers,joseph.rogers@example.com,851.999.5863x15629,1989-09-06,078 2nd Ave,New York,NY,24986-2514,Manhattan,Email,Room site like PM prove smile. Computer policy space network. Guess individual thing leave body suddenly shake.,Government
Alexander Stewart,alexander.stewart@example.com,(227)949-3519,1978-06-11,5101 Forest Ave,New York,NY,94353-2009,Staten Island,Email,"Himself south into process impact. Office so produce challenge professor skill own.
Important win key in. Star include yourself. Course down move last only conference.",Small Business
Dylan Henderson,dylan.henderson@example.com,001-774-745-8470,1997-08-07,80901 2nd Ave,New York,NY,23826-3349,Brooklyn,Mail,"Billion agree eye approach lead. Past agent yeah plant morning.
Lose center international offer. Professional through know but choice.",Small Business
Jack Ramirez,jack.ramirez@example.com,+1-834-852-4170x66224,1961-01-19,50482 Park Ave,New York,NY,37163-2108,Queens,Phone,"Manager general ability. Statement inside assume institution nothing common. Option Mrs present usually possible relate.
Discuss role daughter. Affect others others find physical.",Individual
Steven Nelson,steven.nelson@example.com,658-317-7768,1996-07-15,1221 Northern Blvd,New York,NY,58194-4478,Brooklyn,Mail,"Strong against experience part citizen own. Safe build cut public where chair.
Low then compare seat second end age. Subject improve behavior evening after so something.",Individual
Jessica Miller,jessica.miller@example.com,(551)482-3707x3844,1999-01-02,8457 Bleecker Street,New York,NY,99855-8322,Manhattan,Email,"Something rest ask suggest amount skill see team. Word bar condition. First court second success treat prevent.
Bed take into. Offer behind tough small month.",Small Business
Mia King,mia.king@example.com,600-925-6717x225,1955-09-27,891 Richmond Ave,New York,NY,96795-4636,Manhattan,Mail,"Strong sure black company. Soldier west together decade into case every.
Detail enough wait town not best. Any reach either population choose American.",VIP
Alexander Turner,alexander.turner@example.com,949-662-9533x1941,2004-04-24,35469 1st Ave,New York,NY,88476-4014,Bronx,Email,"She coach task professor firm audience stuff. Red best stage.
Certain experience no. Mrs stage few store raise. Peace customer significant do.",Small Business
Rebecca Lopez,rebecca.lopez@example.com,560-625-4629x28316,1948-01-25,1781 Fordham Road,New York,NY,60734-3923,Bronx,Mail,"End heavy near hair another. Allow everything particular fire discuss.
Oil thousand should concern young field. Pay agree history thousand before teach national. Everyone father left represent word.",Small Business
David Bryant,david.bryant@example.com,001-481-609-1215x3750,1955-07-15,007 Roosevelt Ave,New York,NY,90467-7983,Brooklyn,Email,"Change want cultural research surface wait human. See force rock. Painting a culture soon certainly sit pattern.
Activity wonder I personal end security play. Safe imagine dream success.",VIP
Heather Garcia,heather.garcia@example.com,542-411-8063x700,1962-05-25,3978 Jerome Ave,New York,NY,48980-5387,Bronx,Mail,Chair of drug generation right. Yard help by end even.,Non-Profit
