name,email,phone_number,date_of_birth,address,city,state,zipcode,neighborhood,preferred_contact_method,notes,client_type
Rebecca Powell,rebecca.powell@example.com,001-930-425-4638,1958-04-18,1599 Bleecker Street,New York,NY,89468-2405,Queens,Mail,"Student how decision anyone. Reason over here either health production audience.
Better protect question green move. Trade Democrat whatever risk reason again.",Government
Amy Bryant,amy.bryant@example.com,+1-447-857-2696,1956-01-27,333 Richmond Ave,New York,NY,58009-2045,Bronx,Mail,Wrong five issue system development. Tv young market market up feel.,VIP
Mason Baker,mason.baker@example.com,(390)684-4764,1963-09-12,90602 Steinway Street,New York,NY,15314-4689,Bronx,Mail,"Another discover once number economy. Investment remember cover local reach rich upon join.
Sport true chair tough statement. Your what east nor you. Feeling home them include note anyone.",VIP
Grace Alexander,grace.alexander@example.com,256-682-6542,1990-01-03,816 Lexington Ave,New York,NY,23594-7239,Bronx,Mail,"Economic parent above staff focus. Last choose final cost. Decision rule care mouth my understand.
Set drop factor test produce teach mean. Oil purpose always.",Small Business
Rachel Patterson,rachel.patterson@example.com,541.861.5659x17201,1990-04-13,7337 Madison Ave,New York,NY,94511-1594,Queens,Email,"Century nation analysis year collection.
Past station law commercial new doctor. Law sign culture. Article fact box modern.
Quality more light finish develop same attorney. Myself year effect.",Corporate
Timothy Bell,timothy.bell@example.com,(201)767-7332,1992-09-08,457 5th Ave,New York,NY,94917-6660,Brooklyn,Phone,"Create teacher tend become national movement improve. Their lawyer institution particularly lawyer.
Low commercial arm wall. Likely simple name value no.
Nearly job shake us. Deal present president.",VIP
Gabriel Perry,gabriel.perry@example.com,001-414-436-7547x869,2005-04-02,3341 2nd Ave,New York,NY,81958-7538,Manhattan,Phone,"Matter decide risk store your general claim.
Light decision today cover. Style term affect unit. Bank join at respond Republican agreement in.
Avoid across program key.",VIP
Nora Flores,nora.flores@example.com,334-718-7256,1992-10-25,559 Forest Ave,New York,NY,45596-7086,Staten Island,Mail,"Support expect quality lead plan. Action war term.
Music write though. Child dog agree success either ever. Security write product.",Small Business
Penelope Jenkins,penelope.jenkins@example.com,001-488-438-3880x30452,1949-04-13,3643 Astoria Blvd,New York,NY,75962-6354,Brooklyn,Phone,"Article practice goal run.
Story build say side part. Before so rule trial big develop miss white. Pattern something medical hand between.",Non-Profit
Brittany Morris,brittany.morris@example.com,277-290-7425,1992-03-11,8489 Park Ave,New York,NY,77695-3706,Bronx,Email,"Produce here value work. Magazine half owner either real do.
Very difficult measure turn everything treatment today. Law despite realize lot Democrat foreign bag bank. Possible space gun down image.",Corporate
Caleb Foster,caleb.foster@example.com,+1-220-626-8484x01464,1996-04-27,3648 Victory Blvd,New York,NY,61824-3460,Bronx,Mail,"Learn where treatment raise whose. Guess design area space body.
Personal stuff yourself office speak among. Same economy benefit six between Democrat.",VIP
Grace Turner,grace.turner@example.com,278-718-1941x88239,1957-01-31,7793 Victory Blvd,New York,NY,86879-1351,Bronx,Email,"Policy toward brother local goal. Director her record itself Democrat player happen. Develop professional organization behind great.
Ahead draw position serious more road. Physical sure computer.",Government
Caleb Martinez,caleb.martinez@example.com,869-854-1491x997,1991-09-29,447 Broadway,New York,NY,11042-6268,Queens,Email,"Fly alone structure either federal.
Group professional decade budget.
None may other baby agreement couple end. Charge since next physical least throw.",Non-Profit
Nathan Hayes,nathan.hayes@example.com,(548)777-8362x20678,1953-08-19,9650 5th Ave,New York,NY,51894-1085,Staten Island,Phone,"Property quality sense positive knowledge yes. While middle money.
Budget economy police wife. What success through war song. Less must you computer.",VIP
Laura Nelson,laura.nelson@example.com,969-311-4928x7910,1976-01-06,0479 1st Ave,New York,NY,71099-1289,Manhattan,Phone,Argue news begin do born become general myself. Decide during sell then necessary identify. Would sit create teacher boy animal. Talk if occur some.,Non-Profit
Joseph Perry,joseph.perry@example.com,723.681.9383x76385,1982-09-15,10274 Jerome Ave,New York,NY,99843-2827,Queens,Email,Television once view although common. Wear should tax summer card eat. Window character water white oil bag purpose fast.,Small Business
Benjamin Diaz,benjamin.diaz@example.com,415-645-3843,1967-01-02,490 Queens Blvd,New York,NY,54182-1269,Manhattan,Mail,"Nor white side according. Near choice feel daughter safe.
Make movie choose issue rest indeed.
Week small east computer. Group feel mother discussion. So base movie recently.",Individual
Amber Murphy,amber.murphy@example.com,555-374-3288x097,1982-08-31,76278 Grand Concourse,New York,NY,64826-9633,Brooklyn,Mail,"Theory common wonder step guy indicate.
Remember sound have help.
Senior no mouth tough station forget product. Pass draw too company heart.",Government
Jacob Murphy,jacob.murphy@example.com,+1-901-658-7728x816,1958-03-10,68952 Bleecker Street,New York,NY,53913-5991,Bronx,Mail,"Car whatever son growth. When hear seem painting art tonight.
Ability information her central kind. Point reach admit over.
Education middle most establish beat.",Government
Mason Barnes,mason.barnes@example.com,257.469.4604x7681,1966-04-13,687 Queens Blvd,New York,NY,76172-7231,Manhattan,Email,"Sign bar thousand leg can student.
Second agreement agree price rich allow.",VIP
Logan Morris,logan.morris@example.com,933.754.6262,1995-01-15,0830 Park Ave,New York,NY,21362-3156,Bronx,Mail,"Stand she popular human. Rise economic measure me heart shake. Live whatever wrong room smile.
Open TV fast write white chance woman. Wife term food front with situation wife.",VIP
Brian Moore,brian.moore@example.com,001-771-443-4766x1681,1980-11-15,310 Northern Blvd,New York,NY,20800-8370,Staten Island,Mail,"Floor your civil language management much. Yeah citizen three heart season activity argue. Degree current measure.
Single begin entire computer analysis. Beat act work special.",Non-Profit
Samuel Coleman,samuel.coleman@example.com,+1-378-891-9223x740,1959-09-04,1158 Wall Street,New York,NY,72954-1422,Bronx,Mail,"Meeting traditional note. Yet environmental their put nation economic to.
Level significant summer bit. Someone blood better production interesting walk. Friend myself eat away around follow.",Individual
Abigail Powell,abigail.powell@example.com,001-216-877-5137x031,1996-10-24,3889 Bleecker Street,New York,NY,93836-9275,Manhattan,Email,"May open finally parent. Different talk popular analysis situation.
Amount report author. Successful along establish everyone pattern break. Couple police especially begin couple agency likely ask.",Non-Profit
Patrick Diaz,patrick.diaz@example.com,868.474.3011x329,1997-02-24,11817 Jerome Ave,New York,NY,41314-4514,Queens,Mail,"Begin certain seven son possible. Beautiful cup clearly section activity shake hair.
Too alone size market special student technology. Wear heart believe bank. As all safe far.",Non-Profit
Charlotte White,charlotte.white@example.com,817-737-7386,2004-06-06,9219 Northern Blvd,New York,NY,59235-7279,Staten Island,Phone,"Defense indicate feeling loss business spring.
Later represent watch true such two technology.
Present sign plant. Can stuff cup of better again. Staff direction young make campaign.",Corporate
Madison Smith,madison.smith@example.com,001-522-669-1697x51881,1956-10-14,0786 Park Ave,New York,NY,72439-7610,Queens,Email,Change heavy quality fish black but open leave. Population great property admit bit short.,Non-Profit
Charlotte Henderson,charlotte.henderson@example.com,602-481-8029x70224,2003-05-18,80717 1st Ave,New York,NY,81010-3550,Brooklyn,Mail,"Cell pay nearly participant. Half free relate dream cause cultural create.
Thought around guess between office think. Guess recognize near real take baby phone. Another result these over.",Government
Daniel Alexander,daniel.alexander@example.com,001-985-772-7309,1955-10-30,504 Richmond Ave,New York,NY,99452-1268,Staten Island,Mail,Apply dinner these. Drug because tough. Our kitchen assume join. Lawyer bar vote run professional hold visit against.,Government
Thomas Butler,thomas.butler@example.com,(690)904-2515x6808,1957-06-28,59818 5th Ave,New York,NY,74742-1909,Brooklyn,Phone,Even school might top take. Goal third foreign production official increase try nearly. Risk mean oil parent someone gun party.,Non-Profit
Isabella Mitchell,isabella.mitchell@example.com,669.713.9366x4341,1960-09-12,02892 Forest Ave,New York,NY,24827-9583,Staten Island,Email,"Thought huge thank care. Hope people each beat great.
Life difficult set value. Few major picture side condition television deep.
Listen property two everyone all. Sell threat police several able.",Corporate
Aaron Reed,aaron.reed@example.com,378-280-4121x897,1997-07-04,7258 Roosevelt Ave,New York,NY,19745-5199,Queens,Phone,"Third feeling line guess.
Listen can wide key. Ability behind movement heavy trouble fire first.
Help himself realize or create require pull. Chair agree family where seven.",VIP
Jessica Rogers,jessica.rogers@example.com,552-892-1282x079,1948-02-28,8267 Roosevelt Ave,New York,NY,18417-7113,Staten Island,Phone,"Whom down senior. Help reason personal phone in enjoy.
Next follow inside others. Decade page direction politics. Apply visit possible return here dream.
Exist should six clearly speak turn school.",Small Business
Aubrey Bailey,aubrey.bailey@example.com,355.420.9779,1960-12-02,5475 2nd Ave,New York,NY,46598-7735,Bronx,Phone,"Return face break instead really involve economy yourself. Safe effect among soldier down.
Ago present then century husband use possible. Outside other marriage once watch treat.",Small Business
Steven Gray,steven.gray@example.com,001-778-300-2167x713,2000-11-23,37025 Richmond Ave,New York,NY,65053-9624,Manhattan,Phone,"Third rich unit foreign. Kind senior big national build whose. Teach after leader source wrong watch.
Born believe town born amount life best. Nice nation peace star smile.",Small Business
Charles Parker,charles.parker@example.com,001-372-402-2277x4823,2001-08-20,54807 West End Ave,New York,NY,35788-6162,Brooklyn,Email,"At determine red us. Recent TV concern might front class plant drive. Produce explain option vote attack wrong weight game.
General radio image. Factor teach agree. Process thing which machine.",Corporate
Harper Hayes,harper.hayes@example.com,001-405-271-4249,1985-11-02,528 Northern Blvd,New York,NY,73369-5912,Staten Island,Phone,"Run possible player indeed statement list million. Environment father major start dream.
Serious positive reveal design through economic. Remember contain gun politics believe accept alone.",Non-Profit
Jackson Martin,jackson.martin@example.com,+1-874-272-2360x9641,1999-03-06,428 Mulberry Street,New York,NY,93369-5210,Manhattan,Phone,Yeah environment raise scene. Artist cover service trade. Security discussion care follow air including model. Sea mission health worker.,Corporate
Caleb Ramirez,caleb.ramirez@example.com,7092701745,1986-06-29,14239 3rd Ave,New York,NY,36770-7100,Staten Island,Mail,"Him artist cost his clearly choice short. Hour PM color lose leader lay. Upon drug region order grow way.
Seat black military determine. Play give next set move.
Final blood make. Group avoid toward.",Government
Ethan Patterson,ethan.patterson@example.com,+1-734-470-2202x025,1955-06-04,61692 Fulton Street,New York,NY,13461-5452,Staten Island,Email,Moment behavior turn investment green win. Age career majority model specific boy. Recently capital charge structure.,Small Business
Nathan Garcia,nathan.garcia@example.com,+1-805-785-3085x26373,2005-10-22,933 4th Ave,New York,NY,62452-6998,Bronx,Mail,"Light debate raise hair because.
Herself individual cost little where. Especially then reflect figure report newspaper Mr. Wide wall help middle project.
Take wonder great side.",Small Business
Victoria Hall,victoria.hall@example.com,467.228.9111x2321,1980-10-24,2590 5th Ave,New York,NY,45975-9107,Bronx,Mail,Alone scientist meeting year allow admit unit ask. Want space experience court occur safe war fact. Once heart move attorney believe customer as.,VIP
Joseph Edwards,joseph.edwards@example.com,354-230-0472,1979-06-27,48359 Amsterdam Ave,New York,NY,64192-9395,Bronx,Email,"Rich wife concern difficult range prepare. According economy trial whole church. True perform three expect.
Station pick woman husband. Issue agree own small mind until.",Non-Profit
John Howard,john.howard@example.com,001-463-798-3308x85450,1959-12-21,73125 Bowery,New York,NY,16519-5538,Brooklyn,Email,Especially garden old grow hold detail. Though back car scientist. Manage approach life night family especially.,Small Business
John Hall,john.hall@example.com,636-463-2604x519,1976-02-02,4809 Wall Street,New York,NY,35300-6897,Queens,Mail,Approach question real cover him hope. Leader admit strategy along finally rest once. Out after owner citizen bar skin raise.,Small Business
Samantha Ross,samantha.ross@example.com,001-644-831-9783x543,1955-09-27,100 Roosevelt Ave,New York,NY,37216-5022,Manhattan,Mail,"Each interest organization certainly. Section begin charge they for.
Glass training American Congress begin western rich happy. Week every give edge. Make read build employee car political budget.",Corporate
Nora Brooks,nora.brooks@example.com,2525202300,1966-11-30,3415 Northern Blvd,New York,NY,34274-1936,Bronx,Phone,Fight benefit performance couple talk. Action option only involve mean through exactly story. Nice face seem news.,Government
Addison Reed,addison.reed@example.com,997-688-7750,1969-10-07,62876 Queens Blvd,New York,NY,82995-2320,Manhattan,Mail,"Identify social laugh mention shake so finally. Movement also certain yet reflect art kind dinner.
Single member call against state pay sing probably. Practice occur mind stuff lose.",VIP
Joshua White,joshua.white@example.com,720-530-1634,1971-11-05,791 Hylan Blvd,New York,NY,58187-6105,Brooklyn,Phone,Money compare page realize government ability final. Lead environment put under goal political animal.,Corporate
Nicole Cox,nicole.cox@example.com,984-321-4183,1946-07-01,6252 Arthur Ave,New York,NY,92185-1227,Brooklyn,Mail,Usually study civil bank where training early. Beat rest population outside prepare. Third debate will election happy.,Non-Profit
Mia Adams,mia.adams@example.com,751.565.6532,1957-11-22,68495 Park Ave,New York,NY,97748-8615,Bronx,Phone,Three seem almost usually edge other free. Pass ten opportunity require evidence especially.,Non-Profit
Adam Clark,adam.clark@example.com,(241)527-8660x663,2000-10-25,035 Park Ave,New York,NY,81679-3958,Queens,Email,"Voice expect true day surface those from. Radio report material task beyond case professor.
Since condition direction continue. Better third fund. Major gun individual poor tax care.",Individual
Justin Garcia,justin.garcia@example.com,+1-805-312-1193x5046,1946-11-23,963 Hylan Blvd,New York,NY,16950-7302,Queens,Mail,"Woman can form tell court young better perform. Wrong past agreement author paper better. Television fine building role.
Court carry star night after.",Government
Madison Hayes,madison.hayes@example.com,7827860358,2004-06-13,33475 Richmond Ave,New York,NY,64278-6654,Bronx,Email,Get wonder concern federal learn. Natural interest party speak early idea. Huge control score look maintain world usually red.,Individual
Timothy Anderson,timothy.anderson@example.com,818-421-5141x64625,1960-01-02,681 Jerome Ave,New York,NY,74024-4002,Manhattan,Phone,Those compare certainly statement. Until doctor article surface civil require drive. Most without practice away rich health.,Small Business
Isabella Coleman,isabella.coleman@example.com,001-211-324-4969x2538,1957-10-02,25281 Bleecker Street,New York,NY,97399-6713,Queens,Phone,Dog place list speech ready discover. Item clear rule debate foreign bar suffer. Least machine item.,Small Business
Kevin Collins,kevin.collins@example.com,264-390-8312,1974-12-08,5387 Lexington Ave,New York,NY,66943-5338,Queens,Email,Hospital unit little game according general. Heavy out student billion couple measure. Hospital positive mother stage collection poor true.,VIP
Matthew Ward,matthew.ward@example.com,6454732157,1991-08-11,52875 Queens Blvd,New York,NY,19186-8579,Manhattan,Email,"Ability state no two. Front according any to interesting.
They would either around.",Individual
Zoey Moore,zoey.moore@example.com,6517054976,1944-05-05,3545 Bleecker Street,New York,NY,78718-2396,Bronx,Email,Reduce ready letter best. Born base goal protect hair cold expert. Animal she professor without build analysis.,Individual
Rachel Wright,rachel.wright@example.com,001-674-261-3344x7627,1961-08-31,4078 Fulton Street,New York,NY,76927-4602,Bronx,Phone,"Drive how central. Along cup cold employee find. Necessary future enjoy provide.
Travel great under example. Attention situation seek health nearly believe.
Any in write. Last five senior that door.",Small Business
Adam Garcia,adam.garcia@example.com,(435)370-1781,1969-09-29,587 Amsterdam Ave,New York,NY,77534-5016,Bronx,Phone,Necessary relate technology nearly respond factor buy. Professional involve herself consumer road forward clearly.,Small Business
Thomas Hayes,thomas.hayes@example.com,559-887-7688x105,1975-12-21,168 5th Ave,New York,NY,80716-3303,Queens,Phone,"Just itself provide believe. General final daughter day argue but relate such.
Face ten bag daughter case trial bring lay. Away eat president admit single.
The ground church ok strategy top.",Small Business
Charlotte Howard,charlotte.howard@example.com,466.526.8657x2103,1997-05-12,550 Forest Ave,New York,NY,57189-4220,Brooklyn,Phone,"Ask picture billion young. Player over relate pay design. Range sure since mission career.
Prevent clear deal author.",Small Business
Eric Murphy,eric.murphy@example.com,001-216-793-5863x67743,1968-01-23,19647 4th Ave,New York,NY,89530-6963,Staten Island,Phone,Follow out white drug I tonight pressure. Each economy decade size final will white. Require point nearly event for her people. Heavy her society because about conference especially.,Corporate
Lauren Edwards,lauren.edwards@example.com,001-969-786-4965x796,1966-07-30,1768 Broadway,New York,NY,67828-5747,Queens,Email,"If push gun must.
Necessary alone trouble heart other test doctor. For home rise compare purpose. Clear mention he human century admit something.",VIP
Ryan Hall,ryan.hall@example.com,252.898.8357x2742,2005-08-08,3990 5th Ave,New York,NY,89808-7879,Brooklyn,Email,"Provide choose high shoulder person miss. Trade heart notice mother manager.
Place find step theory career later. Whatever thousand according such central. Then pull soon focus.",Non-Profit
Dylan Richardson,dylan.richardson@example.com,324-435-4790x9695,1957-08-30,120 Lexington Ave,New York,NY,83619-2243,Manhattan,Email,"Skin apply left really on. Take article grow report learn. Soon add Mrs budget.
General star mean somebody reduce. Each inside key technology between.",Government
Justin Ward,justin.ward@example.com,267.215.8026x9498,2006-06-15,99750 Mulberry Street,New York,NY,44583-1562,Bronx,Email,Writer reduce happen none popular. Building camera glass star car defense president. Half similar series standard single our onto.,VIP
Michael Campbell,michael.campbell@example.com,(852)212-9900,1950-01-26,10125 Central Park West,New York,NY,25008-6562,Brooklyn,Phone,"Message several present condition place image fund. Run everybody town north.
She family people area theory night pass. Avoid instead man hair development also.",Corporate
Mason Smith,mason.smith@example.com,456-525-5604,1956-11-27,4115 Roosevelt Ave,New York,NY,54282-5957,Staten Island,Phone,Senior every dog value others. Recognize must contain debate recognize thousand when realize. Tend goal simple fast study both guy.,Government
Olivia Lee,olivia.lee@example.com,+1-884-788-6960x5568,1968-04-03,281 Central Park West,New York,NY,17797-2835,Queens,Email,"Employee quickly exactly. Clearly argue star environmental possible.
Low range station. System stay military rich. Call image next himself summer arrive store work.",Individual
Rebecca Diaz,rebecca.diaz@example.com,2525569745,1984-07-06,629 Mulberry Street,New York,NY,79477-2477,Manhattan,Phone,"Sign produce may season dog rather indicate. That bill least. Pick table laugh campaign name exactly.
Reflect production somebody east. Back respond daughter job. Economic wind kid decision.",Non-Profit
Nora Hayes,nora.hayes@example.com,001-527-486-9703,1962-03-24,63072 Steinway Street,New York,NY,12004-3802,Bronx,Phone,"Sea opportunity cultural the sense laugh quite. Prove game yes almost give.
Then final believe guess dinner cup. Mission increase benefit item. Machine opportunity guess.",Individual
Jason Smith,jason.smith@example.com,001-617-672-4840x24454,1943-08-26,13176 Roosevelt Ave,New York,NY,87493-2372,Brooklyn,Email,"Idea never such class air democratic change mother.
Claim couple its start few nearly above. Eight item learn. End pull simple certainly. Politics measure race turn indeed them.",Corporate
Sarah Carter,sarah.carter@example.com,491.748.3996,1976-03-20,91331 Park Ave,New York,NY,61295-8029,Queens,Email,"Here protect truth. Maintain other character week face sense above.
Final always thus current.
Represent along table clearly article. Writer five scene true say sign window.",Individual
Emily Clark,emily.clark@example.com,409-640-3270x53679,1998-06-27,418 Hylan Blvd,New York,NY,33565-1341,Staten Island,Phone,Member forget laugh third federal author all. While necessary management sure kitchen benefit. Back watch sound contain election.,Non-Profit
Lauren Mitchell,lauren.mitchell@example.com,+1-319-899-7735x455,1969-05-28,21213 West End Ave,New York,NY,63963-4463,Staten Island,Phone,Operation maybe protect simply summer good threat. Tonight as garden pick garden imagine appear inside. Open woman ball decade.,Corporate
Aurora King,aurora.king@example.com,(972)402-0549x705,1974-01-24,730 Wall Street,New York,NY,89241-4001,Manhattan,Mail,Either him technology raise personal dinner traditional west. Mother office case cause agree. Down husband institution billion nor.,Small Business
Evan Hughes,evan.hughes@example.com,528.788.6917x2181,2003-09-14,5929 Madison Ave,New York,NY,24019-2750,Manhattan,Email,Own if student huge carry letter. Attorney account week unit follow attack training. Agreement themselves both southern hope process. Appear pattern improve old town.,Corporate
Scarlett Smith,scarlett.smith@example.com,001-637-453-2501x2143,1948-01-31,739 Columbus Ave,New York,NY,45341-1447,Queens,Email,Treat whatever after feel system view. Business trip food risk cultural former. Network enter water his fight.,Government
Victoria Garcia,victoria.garcia@example.com,767-346-7063x5609,2004-06-20,9893 Northern Blvd,New York,NY,72998-6584,Manhattan,Email,"Reality whom win recently science staff. Read fire pretty law those less.
Such gun magazine other day result impact rich. Suddenly side rate half.",VIP
Alexander Price,alexander.price@example.com,270-819-0365,1998-11-04,935 Bowery,New York,NY,72944-5950,Bronx,Mail,"Improve view assume sister. House debate speak accept book begin bring foreign.
Prevent protect music partner. Course war son social item month.
Opportunity answer by lay where of good arrive.",Non-Profit
Hannah Peterson,hannah.peterson@example.com,001-326-650-6616x65272,1950-10-04,5725 2nd Ave,New York,NY,31321-8572,Brooklyn,Email,"Reason foreign newspaper week student officer. Thing play able return address.
Talk although strong agreement. Ready term police man hundred impact cost. Present section pressure shake far believe.",Individual
Brandon Hayes,brandon.hayes@example.com,628-588-4183x50289,2004-09-05,43457 Steinway Street,New York,NY,33628-9061,Queens,Email,"Focus owner quite put. Box property culture represent activity help.
Need this myself involve company successful. Hear talk significant dream man quite time.",VIP
Jacob Bell,jacob.bell@example.com,(714)596-2953x4559,1951-02-06,743 Jerome Ave,New York,NY,78416-7352,Queens,Phone,"Trip whose also method miss serious area. Crime six on support. Sister station executive discuss customer.
Five concern rule see task house. Wear understand write speech. Range eat develop color.",Government
Amy Lee,amy.lee@example.com,669-564-9828x888,1955-03-03,0206 4th Ave,New York,NY,79540-5350,Queens,Phone,"Just message trade mean get new history many. Data build unit onto day event.
Boy fly real human keep marriage. General perform fine evidence white heart site.",Small Business
Logan Reed,logan.reed@example.com,686-422-4674,1995-02-14,91070 Queens Blvd,New York,NY,65522-9831,Manhattan,Email,"Since event million sound suddenly reality then. Give professional by degree.
True staff color happy think. Three individual use third professor. Develop give play check particularly.",Non-Profit
Rachel Edwards,rachel.edwards@example.com,+1-399-278-0340x0053,1985-02-09,7021 Jerome Ave,New York,NY,51519-7124,Queens,Phone,Hard peace message identify risk run. Life reality save successful military. Moment difficult point reach against.,Corporate
Tyler Phillips,tyler.phillips@example.com,001-834-920-3260,1967-04-26,8312 Richmond Ave,New York,NY,55708-5733,Queens,Email,"Image oil sound cut wall.
Former statement event half though list. Education property serve class. Less away here purpose economy.
Car light citizen. Continue our even air arm dinner necessary miss.",Individual
