name,email,phone_number,date_of_birth,address,city,state,zipcode,neighborhood,preferred_contact_method,notes,client_type
Justin Howard,justin.howard@example.com,(998)949-3288x61879,1986-01-20,1115 Amsterdam Ave,New York,NY,18430-4563,Manhattan,Phone,"Bad above garden need. Tough tough discover once must deep everybody. Hospital exactly natural television network full thing class.
Democrat billion recently remain there middle.",Non-Profit
Caleb Johnson,caleb.johnson@example.com,308.806.1230,1949-06-07,46517 Park Ave,New York,NY,39883-7475,Staten Island,Email,"Different federal position. Head poor before wall.
Minute civil state. Skill exist throughout interview beautiful. Blue program article include care share into.",Corporate
Scarlett Watson,scarlett.watson@example.com,+1-853-594-1023,1989-05-06,054 Wall Street,New York,NY,25892-4132,Staten Island,Phone,"Speak deal development stock nothing. Bar behind smile then like life.
Travel up investment church hair.",Government
Aria Baker,aria.baker@example.com,547-823-9414,1982-04-17,6095 5th Ave,New York,NY,68343-3737,Manhattan,Phone,"Trial understand agreement. Send right speak American. Hotel message less environment pass upon nation.
Several consumer yes baby medical. Turn operation know government it wish indeed pass.",Individual
Ashley Ramirez,ashley.ramirez@example.com,243-354-2564x176,1984-06-08,5214 4th Ave,New York,NY,65288-1028,Bronx,Email,Step parent brother hot black piece defense. Stock benefit member past summer skin true seek. Gun both couple machine general.,Government
Abigail Cox,abigail.cox@example.com,794.702.4320x465,1979-05-13,702 5th Ave,New York,NY,74504-6660,Manhattan,Phone,Believe mother trade others brother six. Town tree mean how call. Foreign clear country house mouth.,Individual
Andrew Ross,andrew.ross@example.com,382.515.1390,1971-08-13,16974 Canal Street,New York,NY,10107-4973,Queens,Phone,Half even agree agree state thing other. Write such community finish draw course. Their baby near.,Small Business
Charlotte Hernandez,charlotte.hernandez@example.com,(373)483-9598,1957-07-10,4802 Houston Street,New York,NY,70547-6052,Manhattan,Mail,"Arm score wait toward beautiful. Military present determine throughout property.
Bank firm create force recent. Economy teacher image. Major fact sound economic large avoid.",Government
Tyler Brooks,tyler.brooks@example.com,(511)265-7172,1985-04-12,581 Wall Street,New York,NY,24420-7301,Queens,Email,"Old total day quality. Another lawyer teacher fear central upon. Structure I family make economy.
Check interesting agree sport detail so.",Small Business
Samantha Jackson,samantha.jackson@example.com,001-827-308-4452,1981-02-19,35463 2nd Ave,New York,NY,61660-5828,Manhattan,Phone,Chance window explain chance forget. Bill clearly maintain federal. Store effect claim strong culture. Stock drive tree final easy meet employee find.,Corporate
Samuel White,samuel.white@example.com,970.261.4588x79516,1980-01-28,2766 5th Ave,New York,NY,23513-4288,Brooklyn,Email,"Reach nothing college. Interesting sing capital growth house number. Charge shoulder no almost.
Positive lot traditional must here fear school common. Data store good travel.",Corporate
Aaron Wright,aaron.wright@example.com,846.221.0282x01003,1961-05-25,058 Richmond Ave,New York,NY,77763-6878,Manhattan,Mail,"Finish police firm full suggest. Rock explain ok air result prepare.
South prove such early. Behavior there building effort past east born.",Non-Profit
Melissa Wright,melissa.wright@example.com,905-983-0159,1996-03-15,18146 Northern Blvd,New York,NY,94169-3446,Queens,Mail,"Before but federal lead. Suddenly edge religious increase social war deal tell.
Probably reach attack act. Day beat American several north. Cold support week.",Corporate
Mason Hughes,mason.hughes@example.com,387.881.0631,2001-10-14,7541 Forest Ave,New York,NY,50327-5722,Queens,Mail,"Choose fast three actually much fund. Its pick individual instead staff nature idea.
Similar something thus response end. President which whom charge once.",Government
Joseph Gonzalez,joseph.gonzalez@example.com,452.776.6393,1971-04-07,1197 1st Ave,New York,NY,31636-2170,Brooklyn,Email,Camera ability up knowledge. Work soldier take wait put myself.,VIP
Jonathan Johnson,jonathan.johnson@example.com,872.397.7003x23563,1965-12-06,500 Queens Blvd,New York,NY,72212-8711,Manhattan,Phone,"Age office number avoid country memory. Natural pull share hard eye. Realize ten challenge least usually. Hard gun as.
Move source beat know simple quickly.",Corporate
Amanda Mitchell,amanda.mitchell@example.com,(434)936-0398,2006-07-14,536 Wall Street,New York,NY,17626-7735,Queens,Email,"Office prove return move. Free reach door light across. Draw already usually try.
Dark west produce. These relationship pay. Agree save professor walk dark Democrat tend.",Non-Profit
Robert Hayes,robert.hayes@example.com,677.484.4345x48345,1964-02-22,6140 4th Ave,New York,NY,91908-6594,Manhattan,Email,"Yourself blood friend reality evening few off. International deep hand draw.
Case remember so morning audience. Heart owner move four newspaper. Dog why to agency size.",Corporate
Amber Lopez,amber.lopez@example.com,364-970-4135x625,1977-02-19,660 2nd Ave,New York,NY,36613-4815,Manhattan,Email,"Military figure item. Star eye finish.
Drug significant yourself yet fly.
Than three couple their. Modern too officer occur daughter smile.",Individual
Lillian Russell,lillian.russell@example.com,(492)887-2066x9631,1959-01-03,0584 Fulton Street,New York,NY,56349-7037,Staten Island,Mail,Take mind book last task foreign whom. All task which trouble near. Throw support still.,Small Business
Paisley Wright,paisley.wright@example.com,(608)939-8177x007,2005-07-24,7832 Wall Street,New York,NY,11316-4705,Queens,Mail,"Sometimes company finally. Current need them perform. Meet so performance him structure.
And better describe tell still drive move skin. Pay large role. Right possible family fact of stand here do.",Corporate
Adam Peterson,adam.peterson@example.com,001-243-961-0284x91919,1943-10-26,21223 Mulberry Street,New York,NY,82311-2274,Manhattan,Mail,Central avoid huge human growth. Travel study political start. Population talk general term system option little.,Government
Nicole Miller,nicole.miller@example.com,(427)645-9158x61528,1998-11-13,6901 Central Park West,New York,NY,69452-9493,Bronx,Mail,Economic open opportunity itself subject wait. Growth treatment debate recognize then create face.,Individual
Ryan Alexander,ryan.alexander@example.com,001-297-454-2474x7858,1944-10-24,14437 West End Ave,New York,NY,64914-9774,Manhattan,Phone,"Break hard girl ok let. Summer state great.
Relate expert the call. Rate whose house brother child tax scene. Idea least myself.",Small Business
Hannah Hall,hannah.hall@example.com,353-374-0366x6306,1969-11-08,81046 Northern Blvd,New York,NY,80202-2240,Staten Island,Mail,"Republican rule show war any financial art. Everybody standard local attorney born four would past.
Responsibility firm answer.",Small Business
Olivia Walker,olivia.walker@example.com,916-649-8257x6540,1972-02-20,83676 Queens Blvd,New York,NY,29770-3958,Brooklyn,Mail,"Thousand might sit account notice leave learn. Then model very different.
Board watch at help national. Two quality base note college.",VIP
Brittany Rogers,brittany.rogers@example.com,6895389678,2002-06-03,5026 Broadway,New York,NY,52175-4793,Bronx,Mail,Water claim father clear modern their if spend. Wish shake trip conference cover enough news.,Individual
Heather Hughes,heather.hughes@example.com,7952959751,1957-10-20,60901 Jerome Ave,New York,NY,59157-6978,Brooklyn,Phone,Always assume face work learn prove. Kid smile give establish. Individual office put including unit author. Live evening test scientist.,Corporate
Mia Stewart,mia.stewart@example.com,3329455649,1972-05-27,7706 Astoria Blvd,New York,NY,77457-8482,Queens,Email,Economy without smile near fill in old. Great nature certainly other. Project sign kitchen.,VIP
Lillian Cook,lillian.cook@example.com,319.562.4613x44416,1961-01-21,6009 Northern Blvd,New York,NY,12068-1719,Brooklyn,Mail,Before interesting ok other that me billion. Positive player buy seven. Professional trial customer situation drop treat value.,Government
Madison Parker,madison.parker@example.com,544-412-6941x9125,1952-11-12,376 Hylan Blvd,New York,NY,15508-1194,Brooklyn,Email,"Kind easy call executive girl. Husband Republican save issue another democratic claim. Rock become rock pattern take then.
Sound challenge owner site approach end. Gas section film.",VIP
Cameron Sanders,cameron.sanders@example.com,(633)876-3137,1964-10-09,89382 Mulberry Street,New York,NY,69074-9856,Queens,Mail,"Police theory watch involve character yes approach. Note state education participant.
Use here peace practice. Young check information left college.",Non-Profit
Jane Ross,jane.ross@example.com,(956)898-1588x90167,1983-09-25,61713 5th Ave,New York,NY,52244-9805,Bronx,Phone,"New control receive particular. Hour include drive shake. Reflect how close determine apply indicate customer wife.
Quality stuff standard clearly kid. Stock effect fast term.",Small Business
Nathan Murphy,nathan.murphy@example.com,+1-637-585-0442x7464,1958-02-04,6418 Northern Blvd,New York,NY,52508-8036,Manhattan,Mail,"Score me do final floor.
Building onto include position usually never plant rate. Lead story special both clearly black bill. Important might which fire avoid table.",Small Business
Amanda Hernandez,amanda.hernandez@example.com,563.400.4046x527,1986-12-03,1104 Lexington Ave,New York,NY,15112-3406,Brooklyn,Email,"Example home size firm free find conference.
State camera let. Name skin start response yet already father. Feeling difficult reflect determine police child.",Small Business
Grace Sanders,grace.sanders@example.com,+1-464-667-7530,2004-09-05,20838 Park Ave,New York,NY,14150-4811,Bronx,Phone,"Issue possible until also particularly. Data star guy page case ever everybody. Condition late become trouble group enter.
Response hope go generation.",Individual
Megan Ward,megan.ward@example.com,211-289-4906,1967-03-12,374 Richmond Ave,New York,NY,85829-5481,Brooklyn,Mail,"Sell practice it recently energy baby allow. Lot source sport mouth.
Land audience history five follow suddenly suffer. Admit yard low people.",Government
Joshua Brown,joshua.brown@example.com,534.470.7591,1957-08-09,9506 Forest Ave,New York,NY,26016-7652,Queens,Mail,"Cultural front beautiful laugh place. But eight according drop trouble quickly.
Down ahead five anyone worker. Model brother receive subject. Vote for agreement unit girl.",Small Business
Robert Lewis,robert.lewis@example.com,4657354788,1988-04-12,769 Fordham Road,New York,NY,17396-1285,Staten Island,Email,Benefit cut mean indicate recent read nor. Build pull view important fund. Trade federal pay long clearly fight that clearly.,VIP
Tyler Turner,tyler.turner@example.com,842-716-6645x907,2002-08-03,38679 Amsterdam Ave,New York,NY,47043-5974,Brooklyn,Phone,"Paper interesting face more art best carry. Perform institution race opportunity either.
Thousand executive environmental onto compare mind. Hand couple within child skill.",Individual
Jessica Garcia,jessica.garcia@example.com,+1-957-609-4530x257,1953-10-14,4553 Fordham Road,New York,NY,60375-4131,Queens,Email,Model call production western common none employee. Seem difficult guy be. Who help address security.,Government
Tyler Wilson,tyler.wilson@example.com,6497234070,1997-11-06,002 Park Ave,New York,NY,72270-1469,Queens,Phone,"Capital soon family take no. Send impact act father time happy agency. International figure at lot decide at he smile.
No imagine population school health. Hospital wide machine message.",Non-Profit
Joseph Mitchell,joseph.mitchell@example.com,885-231-3036,1996-09-20,5420 Northern Blvd,New York,NY,68364-5001,Manhattan,Email,"Find loss tax event. Reflect side firm choose. Church end compare a.
For development quality around include west. Car PM land energy edge.",VIP
Aurora Perry,aurora.perry@example.com,500.638.7453x894,1998-04-26,5254 Lexington Ave,New York,NY,33465-6927,Manhattan,Phone,Positive girl strategy wall else room cup. Full receive suffer at day group management. Century program former among. There service old cold various right street.,Non-Profit
Gabriel Perez,gabriel.perez@example.com,001-258-613-2745x575,1989-08-23,4054 Northern Blvd,New York,NY,95989-7660,Bronx,Phone,"White own meeting degree. Author myself true.
City shoulder among cultural. Nor ok probably.
Respond drive baby site industry. Send friend deal budget catch these.",Government
Victoria Harris,victoria.harris@example.com,665.463.5531x03663,1965-05-22,60961 Jerome Ave,New York,NY,84313-9518,Bronx,Phone,Such green as government their protect mouth chair. Room voice response spend paper worker itself. Pm be nice all reality.,Corporate
Layla Rivera,layla.rivera@example.com,001-689-429-8417x49107,2005-12-21,661 West End Ave,New York,NY,23412-7844,Queens,Mail,"Follow you evidence imagine. Actually we strategy decision clear year.
Shake there space easy environmental build. Team address one memory.",VIP
Jordan Alexander,jordan.alexander@example.com,927.527.0795x4238,1980-01-15,806 Bleecker Street,New York,NY,34768-3656,Brooklyn,Email,Something suggest there husband opportunity. When dinner energy success history small admit.,Individual
Stephanie Carter,stephanie.carter@example.com,(656)840-2092x0566,1976-07-16,19929 Central Park West,New York,NY,58136-5149,Staten Island,Email,Sound well say factor development standard. National add would. Strong person unit try fish.,VIP
Victoria Price,victoria.price@example.com,+1-646-392-2695x48883,1999-08-24,8235 Central Park West,New York,NY,20644-2330,Queens,Phone,"Imagine know open where. Charge trouble southern four.
Professional force site skill along road. Also able hope step fly measure. Oil speak strong.",Government
Jacob Perry,jacob.perry@example.com,327-357-0095x73608,1987-05-11,6364 Steinway Street,New York,NY,10718-6795,Queens,Email,Skin relationship year religious third. Team authority work history us for. Turn letter push decision remain standard reality.,Corporate
Olivia Washington,olivia.washington@example.com,(669)875-8892x084,1997-07-04,129 Victory Blvd,New York,NY,18985-5998,Staten Island,Mail,"Tree floor opportunity challenge. Focus stay mean first serious necessary owner.
Way must so. Foot kid oil attack treat.
Forward manage occur window institution three. Body whether them effect.",VIP
Emma Rodriguez,emma.rodriguez@example.com,+1-330-562-4849,1970-07-11,71432 Victory Blvd,New York,NY,41728-1825,Queens,Email,Behind rate case pressure down common support. Region return paper control. Without like young respond picture listen direction.,Small Business
Jack Morgan,jack.morgan@example.com,507.949.9075x99623,1985-04-25,72736 Northern Blvd,New York,NY,30668-5239,Queens,Phone,"Guy product voice. Only board media either five baby catch.
Ever can raise war line agree carry age. Strong the state difficult community life.
Assume begin someone hear class.",VIP
Charlotte Cox,charlotte.cox@example.com,973-331-5726x6878,1968-04-29,868 Northern Blvd,New York,NY,42888-9010,Queens,Phone,"Blue dark development.
Throughout analysis body idea community car enter. Card manage skill friend task. Door TV term south animal.",Individual
Samantha Rogers,samantha.rogers@example.com,6106720760,1952-05-04,6893 5th Ave,New York,NY,12978-7490,Manhattan,Mail,"Tax staff ability which herself. Common public feeling particularly add lot.
Strategy son many special per later. Rate need direction eye.",Individual
Nathan Wilson,nathan.wilson@example.com,(570)741-0724,1980-01-13,925 Houston Street,New York,NY,71537-9896,Bronx,Mail,"Billion own describe sister financial end. Whose parent something.
Medical add career. Brother somebody firm however.
Research yard put indeed common.",Individual
Grace Reed,grace.reed@example.com,209-501-8160x5985,1986-12-24,569 Park Ave,New York,NY,30657-4306,Bronx,Phone,North commercial baby their east during. Nation country direction general. Reason world college movement discover life information.,Corporate
Harper Foster,harper.foster@example.com,7934597980,1950-07-14,6498 Broadway,New York,NY,93639-9893,Manhattan,Email,Visit offer begin whole increase. Us in school agreement industry. Year three news yes environmental require. Resource dog next ask still interview.,VIP
David Moore,david.moore@example.com,+1-847-510-6253x45580,1953-12-01,754 Hylan Blvd,New York,NY,79755-5226,Queens,Mail,"Character sound evening green. Stage financial east.
Central various quality while. Assume first yeah product girl. Industry Democrat view early official site.",Corporate
Charles Mitchell,charles.mitchell@example.com,748-702-2272,2002-12-14,2609 Forest Ave,New York,NY,86509-4188,Brooklyn,Mail,"Body police teach support.
Improve total share. Marriage structure note American.
Author again local quickly arm. Spring through throughout simple trial.",Individual
Michael Ward,michael.ward@example.com,001-428-807-4512x43178,1982-09-20,919 Victory Blvd,New York,NY,77103-3222,Brooklyn,Mail,"Way should cover difference. Tax agent interview despite increase production whatever improve. About right station clear probably technology remember big.
Vote structure every line member.",VIP
Paisley Hernandez,paisley.hernandez@example.com,+1-616-569-8750x13726,1976-10-04,66548 Hylan Blvd,New York,NY,17332-9983,Manhattan,Phone,Without financial movement sense begin magazine defense billion. Stand end factor sell interview board seek. Off surface pretty offer identify agent. Wall image deep about she market quite yard.,VIP
Stephanie Young,stephanie.young@example.com,+1-999-980-2608,1994-01-10,878 Hylan Blvd,New York,NY,25815-6238,Staten Island,Email,"Fire town outside scene security thing soon form. Heavy once scene game book.
West throughout hot sister guess floor involve.
Page kid eat for. Story walk clear space wide they.",Individual
Benjamin Scott,benjamin.scott@example.com,(341)519-9358,1971-12-28,653 Richmond Ave,New York,NY,81718-9804,Staten Island,Email,Begin process ability actually child call. Garden politics water teach.,Corporate
Mason Mitchell,mason.mitchell@example.com,001-439-643-3100x53005,1961-07-03,9089 1st Ave,New York,NY,17439-5270,Brooklyn,Email,"About seek structure visit note live write. Those you doctor.
Away personal house poor. Republican effect sound brother key.",Corporate
Adam Moore,adam.moore@example.com,4124717277,1977-05-15,84595 Grand Concourse,New York,NY,83331-5458,Staten Island,Phone,Oil art race never nature. Recognize suddenly need party member. Already stand far blood stage interview. May technology black significant safe.,Government
Evan Griffin,evan.griffin@example.com,+1-457-427-6185x467,2005-06-14,6260 Richmond Ave,New York,NY,42779-6788,Queens,Phone,"Spring himself increase we. Wind certain ability mouth eat.
Term truth focus find treat here single. Statement avoid data trial. Pm expert idea good.",VIP
Melissa Young,melissa.young@example.com,544.483.5821x37392,1945-09-20,1945 2nd Ave,New York,NY,20504-3225,Bronx,Phone,Matter protect someone air wish score new.,VIP
Ellie Peterson,ellie.peterson@example.com,496.822.6217x814,1973-02-11,64196 3rd Ave,New York,NY,19311-4486,Brooklyn,Mail,Particular company over others say. Lead clear make four he. Four begin how miss court.,Non-Profit
Mia Martinez,mia.martinez@example.com,200-905-3890x475,1945-06-03,9516 Fulton Street,New York,NY,60190-5018,Bronx,Email,"Vote analysis society artist. Movie early manage dinner.
Movie blue young because art. Base measure instead particularly finally. Tend process final source decide economy course.",Government
Mia Hernandez,mia.hernandez@example.com,975.528.3887,1985-04-14,7180 Canal Street,New York,NY,14001-2978,Bronx,Phone,Over particular hit personal dinner likely later. Believe stop center wish after. Central recent care do these every.,Small Business
Aaron White,aaron.white@example.com,813.706.0639,1982-04-23,89491 Canal Street,New York,NY,70722-6582,Queens,Mail,Whom money performance build. Conference father a miss fight if. Include trip store option interest.,Small Business
Sarah Johnson,sarah.johnson@example.com,+1-749-405-5064x8062,1985-02-09,2354 4th Ave,New York,NY,22479-3854,Manhattan,Email,"Able often gas cup. From sense from. Participant region military to significant message.
Evening dinner road. Person owner blood free item.",VIP
Ethan Thompson,ethan.thompson@example.com,+1-374-999-5412x1244,1993-07-21,621 Richmond Ave,New York,NY,60856-1368,Manhattan,Mail,Election book image manage small rather. Travel walk visit fire make major. Window owner understand office right doctor choice.,Non-Profit
Ellie Bennett,ellie.bennett@example.com,(745)718-4771,1992-03-12,48652 Richmond Ave,New York,NY,38432-1035,Bronx,Email,"Bit thing heart report sea. Build career girl artist adult. Subject data cover decision trip believe play.
Movie laugh until military time girl between. She dog heart public cause.",Corporate
Megan Adams,megan.adams@example.com,+1-757-435-8568x218,1986-05-18,664 Central Park West,New York,NY,50223-3415,Bronx,Phone,"Interview cup audience management step easy. Form time cell certainly. Raise teacher bill manage short stuff.
Left impact whole table buy ball authority fear.",Individual
Brittany Young,brittany.young@example.com,7803745965,2003-02-28,1494 Richmond Ave,New York,NY,16170-2232,Staten Island,Mail,"Hear father age book phone son I care. Use conference owner see picture class maybe. Military American measure especially.
Between trial former laugh agency night. State girl time oil dream.",Individual
Paisley Miller,paisley.miller@example.com,001-294-536-0754,2001-01-18,673 Mulberry Street,New York,NY,70185-5666,Brooklyn,Mail,Daughter agree five floor they real. And store remember. Hope performance something share citizen cold away.,Individual
Joseph Price,joseph.price@example.com,(670)676-8684,2001-06-10,923 Astoria Blvd,New York,NY,46521-5678,Staten Island,Email,"Meeting then image professor game performance modern. Economic such defense game.
Their cultural rich financial. Energy rise its myself create.",Non-Profit
Rachel Robinson,rachel.robinson@example.com,942-613-0900x85622,1947-02-06,965 4th Ave,New York,NY,10168-2331,Bronx,Email,"Interest voice message alone test experience through. Responsibility than especially decide fact bar. Middle kitchen glass the.
Market appear story major in study me tend.",Government
Evan Morris,evan.morris@example.com,726.716.9415x13095,1995-05-13,2108 2nd Ave,New York,NY,56589-9754,Bronx,Email,Establish experience look statement vote that. Some information eat total. Crime decision herself until.,Government
Emma Jackson,emma.jackson@example.com,9856641889,1966-12-13,684 3rd Ave,New York,NY,91753-3557,Queens,Phone,Early technology minute very skin community market gun. Region crime happy indeed read market white. Experience quality marriage sign.,VIP
Brittany Richardson,brittany.richardson@example.com,(513)633-8428,1947-09-29,713 Mulberry Street,New York,NY,51815-1773,Staten Island,Mail,Government follow both. Political money direction statement send affect dinner cover. Moment wish amount administration.,Individual
Justin Watson,justin.watson@example.com,3129499029,1968-05-14,3185 Bleecker Street,New York,NY,21499-8270,Manhattan,Phone,For south why know professor specific often. Number parent family phone region oil most. Growth indicate address let lawyer.,Government
Jonathan Cook,jonathan.cook@example.com,333.882.1391x50979,1990-07-10,61999 Astoria Blvd,New York,NY,35459-5034,Bronx,Email,"Attorney lot scientist foot image movement. Record rest skill forget company.
Their ability age chair book have give president. Break similar without evidence top seem.",Non-Profit
Lillian Rogers,lillian.rogers@example.com,989-956-7351x346,1985-03-26,5525 Bleecker Street,New York,NY,78909-2577,Brooklyn,Email,"Range machine table themselves tax level clearly.
Tonight western media nearly rate condition decade. Deal report hour.",VIP
Benjamin Ramirez,benjamin.ramirez@example.com,001-846-563-3113x6325,1972-12-28,426 Central Park West,New York,NY,54941-5175,Brooklyn,Mail,"Western hotel much later nearly. Part age we. Base face fall same.
House if act agreement hear. Child officer carry community now easy use. Through alone argue by with major trouble difficult.",Government
Avery Phillips,avery.phillips@example.com,412.367.6097,1969-12-25,58247 Astoria Blvd,New York,NY,19068-2889,Bronx,Phone,"Degree listen ready outside. So art place quickly usually goal. Gas nature trouble over focus occur.
Window president international couple item evening.",Small Business
Nicholas Johnson,nicholas.johnson@example.com,+1-992-207-4156,1952-02-10,3020 Madison Ave,New York,NY,45696-6223,Staten Island,Email,"Hour all house statement plan good ball describe. Bar try once arrive according.
Sister role miss trip. His behavior live turn home level read statement. Security movie group still conference.",Small Business
Jessica Lopez,jessica.lopez@example.com,(200)520-3651x432,1999-07-02,2170 Jerome Ave,New York,NY,87811-4998,Bronx,Mail,"Commercial box according bring news challenge member.
Or return allow prevent budget century whole. Stand financial work travel public nor.",Individual
Jane Cook,jane.cook@example.com,+1-310-274-0557x320,1952-11-14,265 Columbus Ave,New York,NY,19165-7786,Bronx,Mail,"Remember begin everybody range cost already town. Individual section chair region which place.
Bill pretty describe government usually. Tree answer ahead smile special money by.",Individual
Olivia Hughes,olivia.hughes@example.com,001-638-844-6264x658,1970-01-28,238 Madison Ave,New York,NY,95019-4668,Queens,Phone,"Bed worker although interview. Husband like view add whatever serious Republican. News new lead agree concern consider middle.
Skin I may reach yard way.",Corporate
